id,userName,userImage,date,url,score,title,text,replyDate,replyText
gp:AOqpTOEJltd213hiq1XOObFArkux9SvqppQGuj1bkin61gBlYV2VLkWE4TeTukFBSu4ir8nJBKqkMbPqL9NmdA,Patrizia Anika Aldana,https://lh3.googleusercontent.com/-WY9fZZKbrD4/AAAAAAAAAAI/AAAAAAAAABc/28-Sx2xGVSw/w96-h96-p/photo.jpg,"December 31, 2017",https://play.google.com/store/apps/details?id=com.adult.coloring.book.pages&reviewId=Z3A6QU9xcFRPRUpsdGQyMTNoaXExWE9PYkZBcmt1eDlTdnFwcFFHdWoxYmtpbjYxZ0JsWVYyVkxrV0U0VGVUdWtGQlN1NGlyOG5KQktxa01iUHFMOU5tZEE,5,,"My first coloring app and prolly last too since I don't see the need to download other apps when this works excellently! 😀👍 I wasn't really into coloring and only tried this because I was looking for apps to have fun with my stylus but I had more fun than I expected.  Lots of patterns and color palletes to choose from and has got nice features without distracting ads. Great app, indeed!",undefined,undefined
gp:AOqpTOEbqpm0JHzqKscWYksu1PkZNEOwLtxEyaBRtaPwKlV3g7FjMNRki_25hGTFXV0mpIUtT-lWCOBJ4yX0cA,Junaid Farouk,https://lh3.googleusercontent.com/-TZCZmOn2MN0/AAAAAAAAAAI/AAAAAAAAAJs/-XAFEYdyv0w/w96-h96-p/photo.jpg,"October 2, 2017",https://play.google.com/store/apps/details?id=com.adult.coloring.book.pages&reviewId=Z3A6QU9xcFRPRWJxcG0wSkh6cUtzY1dZa3N1MVBrWk5FT3dMdHhFeWFCUnRhUHdLbFYzZzdGak1OUmtpXzI1aEdURlhWMG1wSVV0VC1sV0NPQko0eVgwY0E,5,,"Wow! This coloring app is truly amazing. Tried a few other coloring apps, but personally ColorMe tops all of them. The app is free and you can color a variety of things. My favorite to do is the mandalas. It's worth all of my spare time and it's very relaxing- stress relieving as well. Good job Adults Coloring Books. ☺ I am definitely keeping this app. 😀",undefined,undefined
gp:AOqpTOHAluIyCGA_xTHDkoCNHuCnNYgp4M3pp9rivC6esRWbhshrR4-X7DosxS86fEucKUpr2Ku43ifRKZHIhQ,Aimee Campbell,https://lh3.googleusercontent.com/-kt-fZFyUk9E/AAAAAAAAAAI/AAAAAAAAAAA/ACSILjVny93_m3VFuVFzCjV3rhThqmht7Q/w96-h96-p/photo.jpg,"December 27, 2017",https://play.google.com/store/apps/details?id=com.adult.coloring.book.pages&reviewId=Z3A6QU9xcFRPSEFsdUl5Q0dBX3hUSERrb0NOSHVDbk5ZZ3A0TTNwcDlyaXZDNmVzUldiaHNoclI0LVg3RG9zeFM4NmZFdWNLVXByMkt1NDNpZlJLWkhJaFE,4,,"This is my first coloring app. I got it due to the review of variety, ease of use, variety, lack of adds, and all pages are actually free.  I was disappointed that it wasn't more like actual coloring where you can pick coloring tool and shade, but I downloaded others that I immediately deleted. Maybe this will help me build to others -this is definitely a good start -that will take me a while  there are tons of pics!",undefined,undefined
gp:AOqpTOHVn0GWnu8dMv4fdPoIVa3TJy9ctbpbileTrGjl0Rvg-DLfUliLBpaejyo6RWC_vJhusv1o6ySYBrgznA,Jennifer Levesque,https://lh3.googleusercontent.com/-_RZ_3NxQ820/AAAAAAAAAAI/AAAAAAAAAAA/ACSILjUQGd3SzN2DHdmICb0911vpROmdEg/w96-h96-p/photo.jpg,"February 3, 2018",https://play.google.com/store/apps/details?id=com.adult.coloring.book.pages&reviewId=Z3A6QU9xcFRPSFZuMEdXbnU4ZE12NGZkUG9JVmEzVEp5OWN0YnBiaWxlVHJHamwwUnZnLURMZlVsaUxCcGFlanlvNlJXQ192Smh1c3YxbzZ5U1lCcmd6bkE,5,,"Best coloring app in the whole app store! I play this app whenever I have  time. ⏰ (Witch is most of the time when I'm not playing my other games!) I know most of you are like,""Well this doesn't look very convincing..."" I knew how you felt but this is a MUST GET APP!  P.S I saw this add on YouTube and I said,""Lets check out this!"" So I got it and I don't regret it!!! Please keep up the great work dot to dot s.r.o! And I love that you can zoom in and out so you get the colors right where you want them; I recommend this app to anyone who wants the best coloring app! You have to get it! 😃",undefined,undefined
gp:AOqpTOGk9CeCf5BnB8O2ag8_6_zRL-exbdtonEYWBwhAuTPDw-KJE6PUrn2rVCooPc-jYgElLMOrGDaWHWF9vA,,https://lh6.googleusercontent.com/-ijdllGcJ564/AAAAAAAAAAI/AAAAAAAACYk/ccRkJr1r3LY/w96-h96-p/photo.jpg,"August 30, 2017",https://play.google.com/store/apps/details?id=com.adult.coloring.book.pages&reviewId=Z3A6QU9xcFRPR2s5Q2VDZjVCbkI4TzJhZzhfNl96UkwtZXhiZHRvbkVZV0J3aEF1VFBEdy1LSkU2UFVybjJyVkNvb1BjLWpZZ0VsTE1PckdEYVdIV0Y5dkE,5,,"This is a great app, good for relaxing and I love that its free and there's no ads! Plus, there are so many options to chose from. Including animals, faces, flowers, mandalas, owls, and more! One more thing.. Its good cause u can save ur drawing and continue on them. Or delete them and start new! Highly recomend!","August 31, 2017",Thank you for such a lovely review
gp:AOqpTOF04YJkEYwiRf6qGmx8TiaLAF4ACswpWHu1kIiKIgWufN_qRbidk2k62l10w10lrS3GTIu_n9SY4_T52w,,https://lh6.googleusercontent.com/-PCxiIpD1M64/AAAAAAAAAAI/AAAAAAAAAAA/0wu1uxlAPEQ/w96-h96-p/photo.jpg,"November 22, 2017",https://play.google.com/store/apps/details?id=com.adult.coloring.book.pages&reviewId=Z3A6QU9xcFRPRjA0WUprRVl3aVJmNnFHbXg4VGlhTEFGNEFDc3dwV0h1MWtJaUtJZ1d1Zk5fcVJiaWRrMms2MmwxMHcxMGxyUzNHVEl1X245U1k0X1Q1Mnc,5,,I love the fact that there is such a huge range of things to colour in and you don't have to pay to download other categories! Not to mention there is so many different colours and 100% ad free!  Best app I've used/downloaded so far. :),undefined,undefined
gp:AOqpTOFqfrXQkuHHtz1JfbnKbj_tAXY0JsDZS60esOJlS8AD2bTQpZQJy6vxo0T54iSvdep1qDFoZWm_A_FM5Q,,https://lh6.googleusercontent.com/-QwE6IVwh5v4/AAAAAAAAAAI/AAAAAAAAAAA/Kr37FbAVY4s/w96-h96-p/photo.jpg,"January 30, 2018",https://play.google.com/store/apps/details?id=com.adult.coloring.book.pages&reviewId=Z3A6QU9xcFRPRnFmclhRa3VISHR6MUpmYm5LYmpfdEFYWTBKc0RaUzYwZXNPSmxTOEFEMmJUUXBaUUp5NnZ4bzBUNTRpU3ZkZXAxcURGb1pXbV9BX0ZNNVE,4,,Good selection of drawings. Not super fond of the layout of the program. For instance the colors disappear when you are drawing. I like how it saves the last 3 colors so you know which you used last. Wish they had some really bright neon colors. Tgank yiu for making a free coloring app! Would recommend,undefined,undefined
gp:AOqpTOE2T22ABXh0ojrM46Mkw3aDXM1hXgStMlN74Y1ELa2m7LFRS7oskw2rxjCQrAwHZbiPQJKHQYopYHlW8w,Robert Ryan,https://lh3.googleusercontent.com/-OLaINGa2dEw/AAAAAAAAAAI/AAAAAAAAAA0/1BkR2KH9hmg/w96-h96-p/photo.jpg,"September 12, 2017",https://play.google.com/store/apps/details?id=com.adult.coloring.book.pages&reviewId=Z3A6QU9xcFRPRTJUMjJBQlhoMG9qck00Nk1rdzNhRFhNMWhYZ1N0TWxONzRZMUVMYTJtN0xGUlM3b3NrdzJyeGpDUXJBd0haYmlQUUpLSFFZb3BZSGxXOHc,5,,"This is the best app I have!! It's relaxing as hell and UNLIKE ALL OTHER COLORING APPS, it's free!! If you check other coloring apps they charged ridiculously crazy prices for JUST different colors! Also new pages to color cost too! NO ADDS OR CONSTANT REQUEST TO SPEND MONEY!! This is a must have as long as it stays free","September 13, 2017",Robert thanks for awesome review.
gp:AOqpTOEFw4juD18U0LZ3ha-cNrNcfW59m9yg9LurJVtRhv4Rct78Q4wJ3WkSod_Bi1x8dn3SshWcqZ69oc8e0A,Ben Goatboy Waters,https://lh5.googleusercontent.com/-n-_a41-cghI/AAAAAAAAAAI/AAAAAAAAAh4/45T7JPvj-eg/w96-h96-p/photo.jpg,"December 1, 2017",https://play.google.com/store/apps/details?id=com.adult.coloring.book.pages&reviewId=Z3A6QU9xcFRPRUZ3NGp1RDE4VTBMWjNoYS1jTnJOY2ZXNTltOXlnOUx1ckpWdFJodjRSY3Q3OFE0d0ozV2tTb2RfQmkxeDhkbjNTc2hXY3FaNjlvYzhlMEE,5,,"I have ADHD and severe anxiety and this app is just like medication, It's my colouring meditation! You just have to try it, coz until you do, you are seriously missing out on one of the most amazing apps in a generation! 10/10 Thanks for making this wonderful app 🙂",undefined,undefined
gp:AOqpTOH-aqPic_fYTQOVe1hWDJhj1bs0sYDV4BmDXr758NdZ2Cr0acQeD5b9w7lZiX7_SkoSUGWZoETAFav5yg,Megan Beno,https://lh4.googleusercontent.com/-KsbbEfxZ-8Y/AAAAAAAAAAI/AAAAAAAAAS8/d66tqhpaIiU/w96-h96-p/photo.jpg,"September 11, 2017",https://play.google.com/store/apps/details?id=com.adult.coloring.book.pages&reviewId=Z3A6QU9xcFRPSC1hcVBpY19mWVRRT1ZlMWhXREpoajFiczBzWURWNEJtRFhyNzU4TmRaMkNyMGFjUWVENWI5dzdsWmlYN19Ta29TVUdXWm9FVEFGYXY1eWc,5,,"Unlike every other app for coloring, it is ENTIRELY free. No premium palettes or designs. And there are lots of fun designs. They need some assistance in their design department, but for free, it is amazing!!  Edit: The designs that I thought were simple ended up being much more involved. Props man. App is a great basic app to while a way the time. :)","September 11, 2017",Megan thanks for fantastic feedback.
gp:AOqpTOHY1nyaNByYHpccBnzZP9lxEil53uRf02-iulWJU_7Fh0EaLt1mmPWnUfSYispxw580ov58nEAqoGfK9A,,https://lh4.googleusercontent.com/-Et58WWRaR8U/AAAAAAAAAAI/AAAAAAAAAAA/ZO0nR4KgFuk/w96-h96-p/photo.jpg,"January 15, 2018",https://play.google.com/store/apps/details?id=com.adult.coloring.book.pages&reviewId=Z3A6QU9xcFRPSFkxbnlhTkJ5WUhwY2NCbnpaUDlseEVpbDUzdVJmMDItaXVsV0pVXzdGaDBFYUx0MW1tUFduVWZTWWlzcHh3NTgwb3Y1OG5FQXFvR2ZLOUE,5,,"I love this app! It is the third colouring app I have  gotten in the last 24 hours, and it is the absolute best! All the other colouring apps you either have to pay for full access or you get a pathetic amount of pictures. I have deleted the other two apps and am very satisfied.",undefined,undefined
gp:AOqpTOGbVe6SfJg9kfDQ-3m7EH33f7_PEs58aaFnb4qnvzM4SZgGLSIQB6wAeAophsYif6rlIkJSnACSM6z03A,Sehar Safdar,https://lh5.googleusercontent.com/-slis6V8ALuE/AAAAAAAAAAI/AAAAAAAAABM/83kLKWid2yU/w96-h96-p/photo.jpg,"December 2, 2017",https://play.google.com/store/apps/details?id=com.adult.coloring.book.pages&reviewId=Z3A6QU9xcFRPR2JWZTZTZkpnOWtmRFEtM203RUgzM2Y3X1BFczU4YWFGbmI0cW52ek00U1pnR0xTSVFCNndBZUFvcGhzWWlmNnJsSWtKU25BQ1NNNnowM0E,5,,It's great.. Especially when you are going through tough times it does take the stress away a bit.. So much selection of designs and a big range of colours.. No ads no needing to spend money it's great.. One thing though if there was a more bigger range of colours then this would be on top but other than that.. Amazing!,undefined,undefined
gp:AOqpTOEEBdhTcQYbAKIH_QZC_tryg1qGW_GExI1OwoFpSiWSw8vqd5o-HtodcGKOQJM--VTBmZcK2q2LB5K5MQ,Kookie Roman,https://lh4.googleusercontent.com/-9d_Y_6ByGyM/AAAAAAAAAAI/AAAAAAAAAjE/eBQBn4Ggoio/w96-h96-p/photo.jpg,"December 22, 2017",https://play.google.com/store/apps/details?id=com.adult.coloring.book.pages&reviewId=Z3A6QU9xcFRPRUVCZGhUY1FZYkFLSUhfUVpDX3RyeWcxcUdXX0dFeEkxT3dvRnBTaVdTdzh2cWQ1by1IdG9kY0dLT1FKTS0tVlRCbVpjSzJxMkxCNUs1TVE,4,,This is a nice time killer when you're bored. I enjoy playing this. The pictures are nice and there's also a wide range of colors. I'd recommend. Though I hope the creators can make more things to color. I think there should be full body portraits.,undefined,undefined
gp:AOqpTOF1FOv4v4UeUaeSwse1dbEKAMoFEMkYmh9apo-XZXJdIBVtibRfvnAUC1ZoIdeoDF4zjqK19dlSHv9tZw,Heidi Samora,https://lh5.googleusercontent.com/-EdZzlKgEak0/AAAAAAAAAAI/AAAAAAAAACA/CjDC6QPGsmQ/w96-h96-p/photo.jpg,"September 19, 2017",https://play.google.com/store/apps/details?id=com.adult.coloring.book.pages&reviewId=Z3A6QU9xcFRPRjFGT3Y0djRVZVVhZVN3c2UxZGJFS0FNb0ZFTWtZbWg5YXBvLVhaWEpkSUJWdGliUmZ2bkFVQzFab0lkZW9ERjR6anFLMTlkbFNIdjl0Wnc,5,,"This app is fantastic for anyone who likes color and being a little creative. I have health issues and this takes my mind off of problems, as I get immediate results from the picture I am working on. Thanks so much!","September 21, 2017",Heidi thanks for great review.
gp:AOqpTOE1NE48B234shC5Fl7CpKSyq4vew8ULez8o64B4UwGCoIPARS5RBNgim3vULSGLAQB8N-n42alDT8Qdow,Diana Scherff,https://lh4.googleusercontent.com/-mVrSg0x86ak/AAAAAAAAAAI/AAAAAAAADrM/n9jEzaflSR8/w96-h96-p/photo.jpg,"December 23, 2017",https://play.google.com/store/apps/details?id=com.adult.coloring.book.pages&reviewId=Z3A6QU9xcFRPRTFORTQ4QjIzNHNoQzVGbDdDcEtTeXE0dmV3OFVMZXo4bzY0QjRVd0dDb0lQQVJTNVJCTmdpbTN2VUxTR0xBUUI4Ti1uNDJhbERUOFFkb3c,5,,"No ads! And all the color options are great. I tried another coloring app and all the ads were annoying and the colors were limited. This app is the best I've found! I'd love a color mixer, but for free, I just can't complain about anything!",undefined,undefined
gp:AOqpTOEcxH-7SuQcOkI2fbWpPikDzzcrofT5hr6q-PvFsSYAsTIUB3hirHnpdWhiz2asnnT4W7tJm-j5K09aEA,Lora Rousseu,https://lh6.googleusercontent.com/-kfA9-pxJ69A/AAAAAAAAAAI/AAAAAAAAAAA/ACSILjVLksF4J8ImfOPN1qZw9xzYTg9LJg/w96-h96-p/photo.jpg,"January 17, 2018",https://play.google.com/store/apps/details?id=com.adult.coloring.book.pages&reviewId=Z3A6QU9xcFRPRWN4SC03U3VRY09rSTJmYldwUGlrRHp6Y3JvZlQ1aHI2cS1QdkZzU1lBc1RJVUIzaGlySG5wZFdoaXoyYXNublQ0Vzd0Sm0tajVLMDlhRUE,5,,"It's really helpful.  When i was downloading it, i was suffering from an attack (won't say what kind), but once i started playing, i calmed down.  Relaxing, addictive.  I could play for hours. And no ads to bug you while colouring. ☺   great game",undefined,undefined
gp:AOqpTOE0uAu2uipbgikKS0a8yD1ISS9IPXLaZ2P5WenSHQ8_ZSEjcMn2d_RqGtxT0u9iYzPtNJ5pA2vypyE0pg,Jac Vann,https://lh4.googleusercontent.com/-qy-xYVak3aY/AAAAAAAAAAI/AAAAAAAAAAA/ACSILjUznc_uASjSEpZUNdYYv59moRbuxg/w96-h96-p/photo.jpg,"September 13, 2017",https://play.google.com/store/apps/details?id=com.adult.coloring.book.pages&reviewId=Z3A6QU9xcFRPRTB1QXUydWlwYmdpa0tTMGE4eUQxSVNTOUlQWExhWjJQNVdlblNIUThfWlNFamNNbjJkX1JxR3R4VDB1OWlZelB0Tko1cEEydnlweUUwcGc,5,,"Very well constructed app. Have been testing a lot of apps and usually the experience is not enjoyable at all. Too many ad intrusions, apps that really test your patience on an Android device. This one however is a keeper. Nice work Devs","September 16, 2017",Jac thanks for fantastic feedback.
gp:AOqpTOEq58GTWlhV5hOVMpGbpm-dxPg0qqTy7Wd2fw_0xsPtbYUbne1MtyPpfONIWpGdlRgW1gOifxJ3QxNKag,,https://lh6.googleusercontent.com/-9ma3-PrbqFU/AAAAAAAAAAI/AAAAAAAAAZM/kEKNL3biSqQ/w96-h96-p/photo.jpg,"October 17, 2017",https://play.google.com/store/apps/details?id=com.adult.coloring.book.pages&reviewId=Z3A6QU9xcFRPRXE1OEdUV2xoVjVoT1ZNcEdicG0tZHhQZzBxcVR5N1dkMmZ3XzB4c1B0YllVYm5lMU10eVBwZk9OSVdwR2RsUmdXMWdPaWZ4SjNReE5LYWc,5,,This coloring app is the bes!  There are so many categories you can choose from!  There many different kinds of colors to use and choose!  I really enjoy this app.  It help me relieve my stress and helps pass time.,undefined,undefined
gp:AOqpTOFyDQ1-cQPwhpqpAN2423su1EVNgVQ_40kTDQBcHj7z5sijqTbcx7yfz_a0eJ4va8rfPwe2P_FSVYwBoA,Leah Samia,https://lh5.googleusercontent.com/-wsxrebNhHdw/AAAAAAAAAAI/AAAAAAAACfw/KpCKuAHLXY0/w96-h96-p/photo.jpg,"September 29, 2017",https://play.google.com/store/apps/details?id=com.adult.coloring.book.pages&reviewId=Z3A6QU9xcFRPRnlEUTEtY1FQd2hwcXBBTjI0MjNzdTFFVk5nVlFfNDBrVERRQmNIajd6NXNpanFUYmN4N3lmel9hMGVKNHZhOHJmUHdlMlBfRlNWWXdCb0E,5,,This is a great app and I am not pushed into a subscription commitment for $40 a year. I would be happy to pay a minimal fee for more coloring pages with additional upgrade fees. I just hate being locked in to an app subscription.,undefined,undefined
gp:AOqpTOFYf8hGv5QKB-F5PV2m9YxYFfFsLgPRe1sWW74RsFm18np6dNNeRr_dN_9VkShRQT_xYCjft8wI6drGDA,Donquel Lawton,https://lh3.googleusercontent.com/-pg0tsf8eG98/AAAAAAAAAAI/AAAAAAAAAAA/ACSILjU99opdxn21aXj5JJl_2wbZnlzUeQ/w96-h96-p/photo.jpg,"August 30, 2017",https://play.google.com/store/apps/details?id=com.adult.coloring.book.pages&reviewId=Z3A6QU9xcFRPRllmOGhHdjVRS0ItRjVQVjJtOVl4WUZmRnNMZ1BSZTFzV1c3NFJzRm0xOG5wNmROTmVScl9kTl85VmtTaFJRVF94WUNqZnQ4d0k2ZHJHREE,5,,It's very addicting and pulls the inner artist out. I get to play with so many different combinations of color! I hope they put out more pictures soon!,"August 31, 2017","Donquel, thank you for amazing review"
gp:AOqpTOFHgmPP-JJqQee3uPYaWZk4zebkNW2o9HHqfZb2O41roKT6MJLQhpdRsePoj8eQg6vszee5fxU69NjwCw,Mia Schu,https://lh3.googleusercontent.com/-Y31Iq7CxHRQ/AAAAAAAAAAI/AAAAAAAAAAA/ACSILjV8XjRhzuF60tGT8RjbZc1Qh31KAA/w96-h96-p/photo.jpg,"September 6, 2017",https://play.google.com/store/apps/details?id=com.adult.coloring.book.pages&reviewId=Z3A6QU9xcFRPRkhnbVBQLUpKcVFlZTN1UFlhV1prNHplYmtOVzJvOUhIcWZaYjJPNDFyb0tUNk1KTFFocGRSc2VQb2o4ZVFnNnZzemVlNWZ4VTY5Tmp3Q3c,5,,"Beautiful patterns and a wide range of pretty colours to choose from - for free! It is easy to use and you can use the same pattern more than once for different colour ways. So far, no annoying ads or being pestered to upgrade for a fee. Where's the catch? (I haven't found one yet, so am upping my review to 5 stars 🌟)","September 5, 2017",Mia thanks for beautiful feedback.
gp:AOqpTOFuuKJ_iq3x9SdyeVAK7r5jKL-lK10c7shxWUe6ZL2BF_Vov7ZwVb6HZR3sIzuangdpEIwW6EpG6AFsEw,Maree Bow,https://lh4.googleusercontent.com/-SSyxaO9rF-4/AAAAAAAAAAI/AAAAAAAAB4c/bJ5YTYeAHBI/w96-h96-p/photo.jpg,"December 23, 2017",https://play.google.com/store/apps/details?id=com.adult.coloring.book.pages&reviewId=Z3A6QU9xcFRPRnV1S0pfaXEzeDlTZHllVkFLN3I1aktMLWxLMTBjN3NoeFdVZTZaTDJCRl9Wb3Y3WndWYjZIWlIzc0l6dWFuZ2RwRUl3VzZFcEc2QUZzRXc,5,,"This is a great app.  It never glitches.  It gives so many pictures and colors to use, unlike some of the other free coloring apps. Great for long waits at the doctors office, or car trips.  My 8 year old grandson loves it too.",undefined,undefined
gp:AOqpTOF2kH1WZ_ESDz6pqwLLuVXFwKiKclndD1jMyab0P7RT8dqUMPWi-QTnkOVSgfLxnBcdj9ZuFGiCMJlqKQ,Friday Zaman,https://lh5.googleusercontent.com/-IodwTFwmnxQ/AAAAAAAAAAI/AAAAAAAAEXw/DH_Wnpzkvy4/w96-h96-p/photo.jpg,"September 13, 2017",https://play.google.com/store/apps/details?id=com.adult.coloring.book.pages&reviewId=Z3A6QU9xcFRPRjJrSDFXWl9FU0R6NnBxd0xMdVZYRndLaUtjbG5kRDFqTXlhYjBQN1JUOGRxVU1QV2ktUVRua09WU2dmTHhuQmNkajladUZHaUNNSmxxS1E,5,,"Best apps so far.. Hey guys. Since u are very responsive to comment, may i suggest that when we hover on a colour, it stated what color it is, that feature will really benificial for a partially colorblind people like me.","September 13, 2017",Thanks for wonderful feedback.
gp:AOqpTOF8-uKA2USj07DJ61xXIjiet7z7LbgrwAKWZx_lDx6iIIkjAaGAfePQmjbogv6egK_bAOy8uaNN5GOehQ,Odallys Idrovo,https://lh5.googleusercontent.com/-Jc3_3T_F3Q0/AAAAAAAAAAI/AAAAAAAAAAA/ACSILjVBHP-QVLt00i9JxjKeAvGNusT60Q/w96-h96-p/photo.jpg,"September 8, 2017",https://play.google.com/store/apps/details?id=com.adult.coloring.book.pages&reviewId=Z3A6QU9xcFRPRjgtdUtBMlVTajA3REo2MXhYSWppZXQ3ejdMYmdyd0FLV1p4X2xEeDZpSUlrakFhR0FmZVBRbWpib2d2NmVnS19iQU95OHVhTk41R09laFE,4,,"Fantastic coloring app! Definitely relaxing to do and the images range from quite a lot (human faces, flowers, animals, etc) I really enjoy variety. Only giving 4 stars because sometimes I close the app by mistake and my coloring image is not saved AT ALL. That sucks because the color scheme I use is so unique it's hard to remember it. Also, it'd be nice to have a recent colors section instead of the just two recent ones.","September 11, 2017",Odallys thanks for great feedback and advice. We´re working on it.
gp:AOqpTOFe98NLTahB8XsUN8qOLzC1kTwApfUAqvQn3Xwkra3p6BzYlFaP5jeKTIJhOSYbvUOeiquKVQnRjq7KVg,,https://lh4.googleusercontent.com/-J-NEvjHULo8/AAAAAAAAAAI/AAAAAAAAAAA/CX8T_Fg8K5Q/w96-h96-p/photo.jpg,"November 23, 2017",https://play.google.com/store/apps/details?id=com.adult.coloring.book.pages&reviewId=Z3A6QU9xcFRPRmU5OE5MVGFoQjhYc1VOOHFPTHpDMWtUd0FwZlVBcXZRbjNYd2tyYTNwNkJ6WWxGYVA1amVLVElKaE9TWWJ2VU9laXF1S1ZRblJqcTdLVmc,4,,It is fun and calming and it is just amazing. A fun mediation but not quite perfect. You can't find a small picture that is easy. And there is only one way to paint the picture.There should be more than one paintbrush,undefined,undefined
gp:AOqpTOGuUA--II1t6p-l1mXIAT0ViQzLFikMw85CcA83sNY552SDKcuog8BhM6ASk8qV2EPPvnIxypGKwbn-yA,Joan Landers,https://lh4.googleusercontent.com/-7Z0jrq71OWg/AAAAAAAAAAI/AAAAAAAAQBw/IFaMo8KecII/w96-h96-p/photo.jpg,"November 27, 2017",https://play.google.com/store/apps/details?id=com.adult.coloring.book.pages&reviewId=Z3A6QU9xcFRPR3VVQS0tSUkxdDZwLWwxbVhJQVQwVmlRekxGaWtNdzg1Q2NBODNzTlk1NTJTREtjdW9nOEJoTTZBU2s4cVYyRVBQdm5JeHlwR0t3Ym4teUE,5,,This is a fun little app exactly what you would expect. It had no ads that I could see. I don't know about the stress relief part but I guess any distracting thing could reduce stress.,undefined,undefined
gp:AOqpTOF71AnQogOtpm_96XgkKu2PFssy3q_CBJcc2ZgdI46o8O3uNlaPKmQBCtPYSWE8WJ2LbKKAYQqzHv0E3A,Sable Voegele,https://lh5.googleusercontent.com/-oypkyrdq5qw/AAAAAAAAAAI/AAAAAAAAAEE/5RS6VVuUF3Q/w96-h96-p/photo.jpg,"October 6, 2017",https://play.google.com/store/apps/details?id=com.adult.coloring.book.pages&reviewId=Z3A6QU9xcFRPRjcxQW5Rb2dPdHBtXzk2WGdrS3UyUEZzc3kzcV9DQkpjYzJaZ2RJNDZvOE8zdU5sYVBLbVFCQ3RQWVNXRThXSjJMYktLQVlRcXpIdjBFM0E,5,,Awesome. Super fun and relaxing. There are so many beautiful pictures to color in with a large variety of colors. You can really let your imagination fly when you use this app because there are so many things you can do with it. Other colorin apps don't have nearly the content of this app.,undefined,undefined
gp:AOqpTOGTQs2_ZdLghIMWr0fI31S2aseeHc7yMD19T-0tE-7ZTKaN4P5SnLq8knSNqAlSHTjr9Oj7DuNY5qN2AQ,Clare Holland,https://lh5.googleusercontent.com/-GcLRHTMic4I/AAAAAAAAAAI/AAAAAAAAEcQ/TnPp2WpawOI/w96-h96-p/photo.jpg,"September 12, 2017",https://play.google.com/store/apps/details?id=com.adult.coloring.book.pages&reviewId=Z3A6QU9xcFRPR1RRczJfWmRMZ2hJTVdyMGZJMzFTMmFzZWVIYzd5TUQxOVQtMHRFLTdaVEthTjRQNVNuTHE4a25TTnFBbFNIVGpyOU9qN0R1Tlk1cU4yQVE,5,,"Brilliant  Omg I love it.. The pictures are brilliant and free..wow.. Best one I've downloaded by far.. Only thing is there are no different types of colour..like pearlised, metallics..but it in no way decreases this brilliant colouring app..it would just improve it..","September 13, 2017",Clare thanks for wonderful feedback. We´re working on it.
gp:AOqpTOGMZkpgPM42k8pFw6pwms3nVk74AT6KYRtwG7Zz1FEwjcAOm3yctp6vgVwv-GLBWigJFJ8wxAezG3FAew,Harshith Bangera,https://lh6.googleusercontent.com/-17YvAaMxkXM/AAAAAAAAAAI/AAAAAAAAA-U/Odho-osPIrQ/w96-h96-p/photo.jpg,"November 20, 2017",https://play.google.com/store/apps/details?id=com.adult.coloring.book.pages&reviewId=Z3A6QU9xcFRPR01aa3BnUE00Mms4cEZ3NnB3bXMzblZrNzRBVDZLWVJ0d0c3WnoxRkV3amNBT20zeWN0cDZ2Z1Z3di1HTEJXaWdKRko4d3hBZXpHM0ZBZXc,5,,"As someone who loves to paint, this is a stunning app. It is easier for those who hate the fact that their outline drawing isn't perfect on paper. It also helps with creativity in colouring. Its relaxing and so addictive. So happy I downloaded this app.",undefined,undefined
gp:AOqpTOFdJvibNy-DzBxGvx2b0ibCmE8SASrYbhoDS7W6trg9H3pIfXS61VUE9rrCROm6_P4ZWdSZMUgQK1II9g,The Watson,https://lh5.googleusercontent.com/-5-6ZLcsygik/AAAAAAAAAAI/AAAAAAAAAtQ/5TDsyOhuwnI/w96-h96-p/photo.jpg,"September 8, 2017",https://play.google.com/store/apps/details?id=com.adult.coloring.book.pages&reviewId=Z3A6QU9xcFRPRmRKdmliTnktRHpCeEd2eDJiMGliQ21FOFNBU3JZYmhvRFM3VzZ0cmc5SDNwSWZYUzYxVlVFOXJyQ1JPbTZfUDRaV2RTWk1VZ1FLMUlJOWc,2,,"Love interface, categories, & pics. Terrible selection of Colors (too limited)! Adding lots more colors would make at least a 4 🌟! Could be great & perfect for rehabilitation.","September 11, 2017",Thank you for review and advice. We´re working on it.
gp:AOqpTOECkfcsv2gjDNxk4eKmdk_3uN-ZcRF8o-1KtA4FL4KaISecxL29OqiDDrcleGpzj19pYzq5OAB3kOgYIA,Jana Crosby,https://lh3.googleusercontent.com/-ge5Ud-XXWrc/AAAAAAAAAAI/AAAAAAAAAIg/5VUUNv7W7Vg/w96-h96-p/photo.jpg,"November 10, 2017",https://play.google.com/store/apps/details?id=com.adult.coloring.book.pages&reviewId=Z3A6QU9xcFRPRUNrZmNzdjJnakROeGs0ZUttZGtfM3VOLVpjUkY4by0xS3RBNEZMNEthSVNlY3hMMjlPcWlERHJjbGVHcHpqMTlwWXpxNU9BQjNrT2dZSUE,4,,I really like the app and coloring over all. It is very relaxing and good selection. The only reason I knocked one star is because very common main colors are missing from the pallet. Needs more colors to be 5 star.,undefined,undefined
gp:AOqpTOE7d_PuvzXjin72wvONu1HPJWDeZw7GEQXHeRKvjoHQNRIfItY_Tw5zmqBKLwRAkU8-3ur-uZrCiC4jNg,Barbara Robertson,https://lh5.googleusercontent.com/-b_3amN8VmF8/AAAAAAAAAAI/AAAAAAAAAAA/ACSILjWxZ5fP7K0yxTPr91DnnSuMWAEzAQ/w96-h96-p/photo.jpg,"January 4, 2018",https://play.google.com/store/apps/details?id=com.adult.coloring.book.pages&reviewId=Z3A6QU9xcFRPRTdkX1B1dnpYamluNzJ3dk9OdTFIUEpXRGVadzdHRVFYSGVSS3Zqb0hRTlJJZkl0WV9UdzV6bXFCS0x3UkFrVTgtM3VyLXVackNpQzRqTmc,5,,App is great but I would like a help screen. When you open coloring page how do you go back to another drawing without exiting the program other than that it's a great great app,"January 26, 2017",Barbara thanks for review and your advice :) we'll take a look at it
gp:AOqpTOHm0UHgn5y3sJwxEq7PKbGuZSx8i8-X_U4phEXloxNkQVV4T6DqFp_1HBnCdPzM7SO5P7XGIIlvRzRqRw,Shreya Amin,https://lh5.googleusercontent.com/-00mYymavoDA/AAAAAAAAAAI/AAAAAAAAAGA/Y_fYyk82jcs/w96-h96-p/photo.jpg,"November 22, 2017",https://play.google.com/store/apps/details?id=com.adult.coloring.book.pages&reviewId=Z3A6QU9xcFRPSG0wVUhnbjV5M3NKd3hFcTdQS2JHdVpTeDhpOC1YX1U0cGhFWGxveE5rUVZWNFQ2RHFGcF8xSEJuQ2RQek03U081UDdYR0lJbHZSelJxUnc,4,,"Great app, but the color pallet doesnt stay on the screen in the Android the same way it stays on the screen in an iPad.  Annoying that I have to open the pallet to see the color choices.",undefined,undefined
gp:AOqpTOFC5MuZlDdLz9KPVNegrScHQctgpZjIhk0LETcBJgWTdmIUb80AMt1UWU8sjsaPKMZcdYqhxoVq9Tq10A,Beatrice Naylor Bower,https://lh3.googleusercontent.com/-kNmf7bQ7V1I/AAAAAAAAAAI/AAAAAAAAC2E/cXHjxH_oR8I/w96-h96-p/photo.jpg,"January 3, 2018",https://play.google.com/store/apps/details?id=com.adult.coloring.book.pages&reviewId=Z3A6QU9xcFRPRkM1TXVabERkTHo5S1BWTmVnclNjSFFjdGdwWmpJaGswTEVUY0JKZ1dUZG1JVWI4MEFNdDFVV1U4c2pzYVBLTVpjZFlxaHhvVnE5VHExMEE,4,,"Very nice! A lack of designs in certain categories, however, and I'd like to be able to do designs again without redoing them. Also, there's kind of a lack of colour choices. Overall, however, It's a brilliant app!",undefined,undefined
