id,userName,userImage,date,url,score,title,text,replyDate,replyText
gp:AOqpTOGfU0NfCGPi46gxtt_EcMNu6il-PijEFVCtAVTj7cEAvSfm0xkysACg637m1kmkAjiQisSXB-QfI4AQeXU,Hillbilly Ramone,https://lh3.googleusercontent.com/-uVYAYmx8Nxw/AAAAAAAAAAI/AAAAAAAALd4/JAneV_Rt0Bc/w96-h96-p/photo.jpg,"January 22, 2018",https://play.google.com/store/apps/details?id=arproductions.andrew.moodlog&reviewId=Z3A6QU9xcFRPR2ZVME5mQ0dQaTQ2Z3h0dF9FY01OdTZpbC1QaWpFRlZDdEFWVGo3Y0VBdlNmbTB4a3lzQUNnNjM3bTFrbWtBamlRaXNTWEItUWZJNEFRZVhV,5,,"Tracks all my moods, prescriptions, and room for random thoughts. Gives time for each entry. As mood changes I am able to record when and how long. I am also able to add or delete  emotions and prescriptions as needed.Very user friendly and simple ui.. Best tracking app I have tried. Only thing I would add would be a dark theme.",undefined,undefined
gp:AOqpTOECndt-sZbAHHL8qo80nXTNGXOi8-C-5rDjddI5I1Ru1z8xw4pgPwRxHm4F_PcXWVfgJ1zuN3D8F5Y5d9E,,https://lh4.googleusercontent.com/-7HYWD4vEgmg/AAAAAAAAAAI/AAAAAAAAAJY/nNiL4-UY0BM/w96-h96-p/photo.jpg,"February 1, 2018",https://play.google.com/store/apps/details?id=arproductions.andrew.moodlog&reviewId=Z3A6QU9xcFRPRUNuZHQtc1piQUhITDhxbzgwblhUTkdYT2k4LUMtNXJEamRkSTVJMVJ1MXo4eHc0cGdQd1J4SG00Rl9QY1hXVmZnSjF6dU4zRDhGNVk1ZDlF,5,,"I like this app a lot. It is easy to use.  I like that you can change the color of the moods, I've set my favorite as positive and my least as negative. It really helps me rate my mood. I also like that there are so many moods to chose from! And the note section is really helpful. I recommend this for people with depression, anxiety or if you just want a mood journal. Five stars.",undefined,undefined
gp:AOqpTOHf8Qg0yxyO5PW06cZA6dje0r8zX1k0Qj4EpXQ7UzrjQZYC03Gl_cL2s5YasfDap2yFUaKQzEzuEVoCmj8,HKN,https://lh5.googleusercontent.com/-DaQPj5lZii0/AAAAAAAAAAI/AAAAAAAAQiw/O10-BC7WiYQ/w96-h96-p/photo.jpg,"December 28, 2017",https://play.google.com/store/apps/details?id=arproductions.andrew.moodlog&reviewId=Z3A6QU9xcFRPSGY4UWcweXh5TzVQVzA2Y1pBNmRqZTByOHpYMWswUWo0RXBYUTdVenJqUVpZQzAzR2xfY0wyczVZYXNmRGFwMnlGVWFLUXpFenVFVm9DbWo4,4,,Would be better if the menus for (moods) symptoms and medications allowed you to type it in and it would search for it. I find it a pain to have to scroll through my whole list. Besides that it is exactly what I needed.,undefined,undefined
gp:AOqpTOGjm-C4x-27lVdGTsuEi-Zf-BCtAly2kLuWiBpKKyLnoRrqB8kmoZDoOXq7OZojxeaaCH072tRV3lN3-ZY,Laurel anon,https://lh3.googleusercontent.com/-nocju7KePZo/AAAAAAAAAAI/AAAAAAAAALQ/ebBVt6IO2J4/w96-h96-p/photo.jpg,"October 24, 2017",https://play.google.com/store/apps/details?id=arproductions.andrew.moodlog&reviewId=Z3A6QU9xcFRPR2ptLUM0eC0yN2xWZEdUc3VFaS1aZi1CQ3RBbHkya0x1V2lCcEtLeUxub1JycUI4a21vWkRvT1hxN09ab2p4ZWFhQ0gwNzJ0UlYzbE4zLVpZ,5,,"Lots of moods to choose from, can add ypur own, tracks medication and drug use, and you can use it to track things like panic attacks, psychosis, mania, self-harm... Doesn't analyse much but its really useful for self-observation.",undefined,undefined
gp:AOqpTOHLpyZ8o3lfB9MvQRJ_GtfSAjY7oLGsmrUCTogQAOxOTSnhv7XP23QGWt3IPcVuQ61kXSfa9NG_Mp52Y3k,,https://lh4.googleusercontent.com/-ApNx4jFtuJk/AAAAAAAAAAI/AAAAAAAAAAA/3g3QcWqNX_o/w96-h96-p/photo.jpg,"November 24, 2017",https://play.google.com/store/apps/details?id=arproductions.andrew.moodlog&reviewId=Z3A6QU9xcFRPSExweVo4bzNsZkI5TXZRUkpfR3RmU0FqWTdvTEdzbXJVQ1RvZ1FBT3hPVFNuaHY3WFAyM1FHV3QzSVBjVnVRNjFrWFNmYTlOR19NcDUyWTNr,4,,"It is a great way to track your mood and the best one that both me and my therapist liked. The only thing I would like is a option to have a reminder more than just 3 times a week, I feel like that could help me a lot.",undefined,undefined
gp:AOqpTOFHm1jBEydR_-3PrXjHQ1LTjhgmbpsev2fzBBARcs2ENdRoIrF1R-DtH5jHOpzygZxI1CdF672MQUWC5wo,,https://lh4.googleusercontent.com/-9YqBygcVHL4/AAAAAAAAAAI/AAAAAAAAAAw/7ym3Jj1wLmw/w96-h96-p/photo.jpg,"October 18, 2017",https://play.google.com/store/apps/details?id=arproductions.andrew.moodlog&reviewId=Z3A6QU9xcFRPRkhtMWpCRXlkUl8tM1ByWGpIUTFMVGpoZ21icHNldjJmekJCQVJjczJFTmRSb0lyRjFSLUR0SDVqSE9wenlnWnhJMUNkRjY3Mk1RVVdDNXdv,2,,"I love this app mainly because it has one feature I couldn't find anywhere: it has more than 5 moods AND they are well described + customisable. One thing that really bothers me: the mood colours. Best case scenario - if I could set a colour for each tag, but if not, I wish ""black"" would be an option (for bad mood), or green-blue to go with yellow-red Edit: thanks for answering and taking my suggestions seriously! What also popped into my mind is that the text (note) is vertical, which makes no sense, because it takes a lot of space and is basically unreadable. Just try typing a note w/ 140 characters (size of a tweet) and you'll see what I mean.","October 17, 2017","Thanks for using Mood log and for the feedback!
I see how having more color options, and colors associated with tags could be really helpful. I'm going to look into adding more color flexibility in a future update.

Thanks again!
Sincerely,
Andrew"
gp:AOqpTOFqSrZWIUVFa8Fz8PdmwtQ0DfnvmWd9se82GZzc4c-3oK5-j6oEhlT8WckcXleK3JBLNzLe6hoBQWBIic4,Stephen MacLeod,https://lh5.googleusercontent.com/-VwpiK8piyn0/AAAAAAAAAAI/AAAAAAAAAAA/ACSILjWTxia_YO45wgGuxzYyftWnTxnMbg/w96-h96-p/photo.jpg,"October 11, 2017",https://play.google.com/store/apps/details?id=arproductions.andrew.moodlog&reviewId=Z3A6QU9xcFRPRnFTclpXSVVWRmE4Rno4UGRtd3RRMERmbnZtV2Q5c2U4MkdaemM0Yy0zb0s1LWo2b0VobFQ4V2NrY1hsZUszSkJMTnpMZTZob0JRV0JJaWM0,4,,"Good app. for tracking moods over time, allowing more accurate reporting trio your health professional than mere memory. Great that you can add your own adjectives etc to describe mods and feelings.",undefined,undefined
gp:AOqpTOGQ7VM4pLAK3aiNPx3SQYvr_SSKBciTddNRHQNxCDIdBLPwfQO-C8iBPZx3HhQ1fXUF7NsAMvCu40M_gc8,Charles Zook,https://lh5.googleusercontent.com/-jYbFXocODVw/AAAAAAAAAAI/AAAAAAAAAAA/ACSILjU0clOPu5zV4Qa6UAychN5IVVRv2w/w96-h96-p/photo.jpg,"October 31, 2017",https://play.google.com/store/apps/details?id=arproductions.andrew.moodlog&reviewId=Z3A6QU9xcFRPR1E3Vk00cExBSzNhaU5QeDNTUVl2cl9TU0tCY2lUZGROUkhRTnhDRElkQkxQd2ZRTy1DOGlCUFp4M0hoUTFmWFVGN05zQU12Q3U0ME1fZ2M4,5,,"It does what it says. Some better visualization of the data and layout of the data entry would dress it up better but I can't complain for free. Ads are unobtrusive, a small bar at the bottom.",undefined,undefined
gp:AOqpTOE63iLfCpYTM-MKej-uVasw8d1MMzo9GQc6WnLoDTfcgWa7OC-Kb_oKKBbxymf65-7KZA-7PzJodyJqNfc,Siobhan Kelly,https://lh3.googleusercontent.com/-8LjpVw09E6U/AAAAAAAAAAI/AAAAAAAAAzQ/0ugrhP5uX8g/w96-h96-p/photo.jpg,"January 27, 2018",https://play.google.com/store/apps/details?id=arproductions.andrew.moodlog&reviewId=Z3A6QU9xcFRPRTYzaUxmQ3BZVE0tTUtlai11VmFzdzhkMU1Nem85R1FjNlduTG9EVGZjZ1dhN09DLUtiX29LS0JieHltZjY1LTdLWkEtN1B6Sm9keUpxTmZj,4,,I have BPD and it's a simple and easy way of tracking changing moods throughout the day. I particularly like how you can personalise the moods and the format of the graph. Good app,undefined,undefined
gp:AOqpTOGTSy3GhBL-_aZZ2ZgB_kk4Q2c-mC6S5kOqZ_-qB69zBZ-1KCICvr7p7QsX0mhELNboxljaXg9qbd5spjM,Talitha Vogt,https://lh6.googleusercontent.com/-lmfgQ24e7Sk/AAAAAAAAAAI/AAAAAAAAA1Q/YkKw46dSwUs/w96-h96-p/photo.jpg,"October 15, 2017",https://play.google.com/store/apps/details?id=arproductions.andrew.moodlog&reviewId=Z3A6QU9xcFRPR1RTeTNHaEJMLV9hWloyWmdCX2trNFEyYy1tQzZTNWtPcVpfLXFCNjl6QlotMUtDSUN2cjdwN1FzWDBtaEVMTmJveGxqYVhnOXFiZDVzcGpN,5,,Really love it. It's extremely helpful! I have mine set to ask me 3 times a day. I've learned a lot about myself by using this app.,undefined,undefined
gp:AOqpTOEzZxr5Ox1Ez3ZmicAxz_3zaZHqrEsccLT8ss3H0wopw4CQXDQh_1B5pa6Vce-dluPACGFhmAonElGMVRw,David LM,https://lh6.googleusercontent.com/--ayHk0kiW1g/AAAAAAAAAAI/AAAAAAAAGq0/22defB5RGrg/w96-h96-p/photo.jpg,"November 9, 2017",https://play.google.com/store/apps/details?id=arproductions.andrew.moodlog&reviewId=Z3A6QU9xcFRPRXpaeHI1T3gxRXozWm1pY0F4el8zemFaSHFyRXNjY0xUOHNzM0gwd29wdzRDUVhEUWhfMUI1cGE2VmNlLWRsdVBBQ0dGaG1Bb25FbEdNVlJ3,4,,"It is a very user friendly app, quite flexible to track mood and meds. I would give 5 if to get the logs were easier.",undefined,undefined
gp:AOqpTOGB4Hv0NQCfSC1zhmn8BC7py2ZcHdZZn5_zx9CCL5XkqjOOpnYU7ZWq_sb681VVNe4mcH5f7O9fRx3CSBA,Linda Hulteen,https://lh6.googleusercontent.com/-F8wJOPVlnbM/AAAAAAAAAAI/AAAAAAAAAAA/ACSILjVs32rnSU6nY_pABU5R_0xpaj1D6g/w96-h96-p/photo.jpg,"January 9, 2018",https://play.google.com/store/apps/details?id=arproductions.andrew.moodlog&reviewId=Z3A6QU9xcFRPR0I0SHYwTlFDZlNDMXpobW44QkM3cHkyWmNIZFpabjVfeng5Q0NMNVhrcWpPT3BuWVU3WldxX3NiNjgxVlZOZTRtY0g1ZjdPOWZSeDNDU0JB,4,,"Nice mood tracker. Easy to use. Easy to customize. I have a question, if I have the upgraded version am I able to print out the graph?","January 10, 2018","Thanks for using Mood Log and for the kind words!
No, the upgraded version let's export your records as a spreadsheet. The records you're viewing are the ones that will be printed out.

Sincerely,
Andrew"
gp:AOqpTOEGxcCD12fHYi223PgPkU-ZK6njfoRnXZsuUYEjX0UeXrtbI91sjawN-d8voCymQkxR8kqOK73h8oU38Tw,Rachael Bangerter,https://lh3.googleusercontent.com/-9oZ-5Z-hk-g/AAAAAAAAAAI/AAAAAAAAAy0/oDlczDPzKw8/w96-h96-p/photo.jpg,"January 25, 2018",https://play.google.com/store/apps/details?id=arproductions.andrew.moodlog&reviewId=Z3A6QU9xcFRPRUd4Y0NEMTJmSFlpMjIzUGdQa1UtWks2bmpmb1JuWFpzdVVZRWpYMFVlWHJ0Ykk5MXNqYXdOLWQ4dm9DeW1Ra3hSOGtxT0s3M2g4b1UzOFR3,4,,"Very simple design, but the user interface is a bit hard to navigate. Otherwise I'd give five stars.",undefined,undefined
gp:AOqpTOEm0CSpc1AAhehxt2KAoTfjlAN9GR4ZJQzeV3hLXVWtmEaK_Ls3O9ew4HTo774TnZOq8BzDfICJ_d7E6vk,,https://lh3.googleusercontent.com/-Exf73eZEwPQ/AAAAAAAAAAI/AAAAAAAAAAA/If_hEFt48RY/w96-h96-p/photo.jpg,"December 26, 2017",https://play.google.com/store/apps/details?id=arproductions.andrew.moodlog&reviewId=Z3A6QU9xcFRPRW0wQ1NwYzFBQWhlaHh0MktBb1RmamxBTjlHUjRaSlF6ZVYzaExYVld0bUVhS19MczNPOWV3NEhUbzc3NFRuWk9xOEJ6RGZJQ0pfZDdFNnZr,4,,I have bipolar so thought this will be a good app to use to see a visual of possible triggers.,undefined,undefined
gp:AOqpTOEFOW6B07xzlnRPPapb5VtRXKa1zyc6RASaT7DVpSxhNIG5hPcPxbIOZuWVt7vtQdxQc8be_SYuqRV5tlI,,https://lh6.googleusercontent.com/-gYP2lk5AXOg/AAAAAAAAAAI/AAAAAAAAAK8/1rOfovp-ykE/w96-h96-p/photo.jpg,"November 29, 2017",https://play.google.com/store/apps/details?id=arproductions.andrew.moodlog&reviewId=Z3A6QU9xcFRPRUZPVzZCMDd4emxuUlBQYXBiNVZ0UlhLYTF6eWM2UkFTYVQ3RFZwU3hoTklHNWhQY1B4YklPWnVXVnQ3dnRRZHhRYzhiZV9TWXVxUlY1dGxJ,5,,It's a great app! My only suggestion would be to add custom colors options.,"November 29, 2017","Thanks for using Mood Log and for the kind words!
In the Settings there are a couple options for customizing the positive and negative colors. I also see how having more color customization could be even better and I'll look into adding that in a future update.

Thanks for the feedback!
Sincerely,
Andrew"
gp:AOqpTOHGKD3SqnzLUVxjSu_Xmks09nMNQFxVY8sazsn6l1Oj_7xM5jboyfgd2B7-FZ-21Q8wehyEJbaCF3V51Zw,Crystal Short,https://lh6.googleusercontent.com/-5LSUfZeRY9E/AAAAAAAAAAI/AAAAAAAAAGY/g4s2ius1hlc/w96-h96-p/photo.jpg,"December 13, 2017",https://play.google.com/store/apps/details?id=arproductions.andrew.moodlog&reviewId=Z3A6QU9xcFRPSEdLRDNTcW56TFVWeGpTdV9YbWtzMDluTU5RRnhWWThzYXpzbjZsMU9qXzd4TTVqYm95ZmdkMkI3LUZaLTIxUTh3ZWh5RUpiYUNGM1Y1MVp3,5,,Great mood log app. Very useful. Love it!',undefined,undefined
gp:AOqpTOF5F_pX6UajWFirczGVnjP_sXNWi5zD1YoYPtYY05T4KFtVjJgaiIJciFypc9VWFwIt-YP-v1-HjkBW49w,,https://lh4.googleusercontent.com/-7EfDVV7f_e4/AAAAAAAAAAI/AAAAAAAAAAA/4yRmHUNmMjI/w96-h96-p/photo.jpg,"January 3, 2018",https://play.google.com/store/apps/details?id=arproductions.andrew.moodlog&reviewId=Z3A6QU9xcFRPRjVGX3BYNlVhaldGaXJjekdWbmpQX3NYTldpNXpEMVlvWVB0WVkwNVQ0S0Z0VmpKZ2FpSUpjaUZ5cGM5VldGd0l0LVlQLXYxLUhqa0JXNDl3,3,,A very basic app with limited input and output,undefined,undefined
gp:AOqpTOHZE6y57h8eG05e-lxJzODNwJe8i_G1b2J0qUH19QXqxvRcVPL8CkQZ7TbbO8qVxCex6n8zfUVyR3bSB64,Renay Mclendon,https://lh3.googleusercontent.com/-CG7LsHKZcCU/AAAAAAAAAAI/AAAAAAAAALw/8ol2dJPgDes/w96-h96-p/photo.jpg,"October 14, 2017",https://play.google.com/store/apps/details?id=arproductions.andrew.moodlog&reviewId=Z3A6QU9xcFRPSFpFNnk1N2g4ZUcwNWUtbHhKek9ETndKZThpX0cxYjJKMHFVSDE5UVhxeHZSY1ZQTDhDa1FaN1RiYk84cVZ4Q2V4Nm44emZVVnlSM2JTQjY0,5,,Great for tracking moods,undefined,undefined
gp:AOqpTOFfQfj5HOS84IQx2qpJk6ZU-vphr38Xg_1ga7gC0qYjzOMc5rRHXppjVXiXoUQPB7KFdxiyrFBilGwZuoo,Roxanne Little,https://lh3.googleusercontent.com/-At1cTB4gHI0/AAAAAAAAAAI/AAAAAAAAACw/WhH1nWeU4RQ/w96-h96-p/photo.jpg,"February 3, 2018",https://play.google.com/store/apps/details?id=arproductions.andrew.moodlog&reviewId=Z3A6QU9xcFRPRmZRZmo1SE9TODRJUXgycXBKazZaVS12cGhyMzhYZ18xZ2E3Z0MwcVlqek9NYzVyUkhYcHBqVlhpWG9VUVBCN0tGZHhpeXJGQmlsR3dadW9v,5,,It's so simple and easy,undefined,undefined
gp:AOqpTOFnPqipW-K7zXfbtMNDfkDsxxADJtv53XaE-yL85eyEShLZ4n5B0ce3FiVVxb20-9Ofz064bjh3FhRQ_8o,,https://lh6.googleusercontent.com/-kvunoDLH8gk/AAAAAAAAAAI/AAAAAAAAAAA/Lo4_A0arZaA/w96-h96-p/photo.jpg,"December 9, 2017",https://play.google.com/store/apps/details?id=arproductions.andrew.moodlog&reviewId=Z3A6QU9xcFRPRm5QcWlwVy1LN3pYZmJ0TU5EZmtEc3h4QURKdHY1M1hhRS15TDg1ZXlFU2hMWjRuNUIwY2UzRmlWVnhiMjAtOU9mejA2NGJqaDNGaFJRXzhv,5,,Great app!,undefined,undefined
gp:AOqpTOFiP_YEN7rZt0r4lvPiBZfbCF33OKgakXTb9Ir23SrNi52p28P443Ds_gLdESbe-GiHN2lZWhpcgn4UJhg,Jack VanDyke,https://lh4.googleusercontent.com/-lWBpXuTuviY/AAAAAAAAAAI/AAAAAAAAADU/VFkAJOyprNE/w96-h96-p/photo.jpg,"January 12, 2018",https://play.google.com/store/apps/details?id=arproductions.andrew.moodlog&reviewId=Z3A6QU9xcFRPRmlQX1lFTjdyWnQwcjRsdlBpQlpmYkNGMzNPS2dha1hUYjlJcjIzU3JOaTUycDI4UDQ0M0RzX2dMZEVTYmUtR2lITjJsWldocGNnbjRVSmhn,4,,helps me reflect,undefined,undefined
gp:AOqpTOFMHxViWFQa3sAQV7svSZZIoy1Rmv1FwXZQvY8WHP_fW8j-F5DMrKqTvoek7xGLGGMlkTvE0DLJ_lKuWw4,Michele Knickerbocker,https://lh5.googleusercontent.com/-QpnIMWSdTf4/AAAAAAAAAAI/AAAAAAAAAAA/ACSILjWteMDAH_XVXNfzbKFl8ouUSV4TkA/w96-h96-p/photo.jpg,"October 27, 2017",https://play.google.com/store/apps/details?id=arproductions.andrew.moodlog&reviewId=Z3A6QU9xcFRPRk1IeFZpV0ZRYTNzQVFWN3N2U1paSW95MVJtdjFGd1haUXZZOFdIUF9mVzhqLUY1RE1yS3FUdm9lazd4R0xHR01sa1R2RTBETEpfbEt1V3c0,5,,Love it because it helps,undefined,undefined
gp:AOqpTOGXFPJiU9_wUyqUm9nfcqKY6S39VUULKKy4eWoHNghjhQbhWHQRrxjvQEhKx6RGQwMijN7JAAHirdnG50U,Elgin Rose,https://lh3.googleusercontent.com/-3_n0aqu2uhc/AAAAAAAAAAI/AAAAAAAAAAA/ACSILjUQmLTT-VbgvCesgOS8xKoupP_meg/w96-h96-p/photo.jpg,"November 29, 2017",https://play.google.com/store/apps/details?id=arproductions.andrew.moodlog&reviewId=Z3A6QU9xcFRPR1hGUEppVTlfd1V5cVVtOW5mY3FLWTZTMzlWVVVMS0t5NGVXb0hOZ2hqaFFiaFdIUVJyeGp2UUVoS3g2UkdRd01pak43SkFBSGlyZG5HNTBV,4,,Easy to use.,undefined,undefined
gp:AOqpTOGChsg3B3jhvDbmsAYczZMs6bCo7AfGqVuFKMENpilwUHC-n_Wa-kq_kU5gSa2mL8_a7Ea_ummqTyvpufY,Bobbie Schmidt,https://lh6.googleusercontent.com/-wbpBWlgScVI/AAAAAAAAAAI/AAAAAAAAAAA/ACSILjXzxMLWA7t_HxZCiyni9ehooSuAwg/w96-h96-p/photo.jpg,"December 11, 2017",https://play.google.com/store/apps/details?id=arproductions.andrew.moodlog&reviewId=Z3A6QU9xcFRPR0Noc2czQjNqaHZEYm1zQVljelpNczZiQ283QWZHcVZ1RktNRU5waWx3VUhDLW5fV2Eta3Ffa1U1Z1NhMm1MOF9hN0VhX3VtbXFUeXZwdWZZ,5,,Cool,undefined,undefined
gp:AOqpTOF9xXMNHad7G9KAI5XVueB03dZjVZRcA1OofcEMTII4RGoo9OZ-5jETeoLYqZSPHX0ef8c9bgILJMYi_kg,Emily Worrad,https://lh5.googleusercontent.com/-hVKEjpU_a_s/AAAAAAAAAAI/AAAAAAAAAKk/b8ctBlWq6ms/w96-h96-p/photo.jpg,"July 15, 2017",https://play.google.com/store/apps/details?id=arproductions.andrew.moodlog&reviewId=Z3A6QU9xcFRPRjl4WE1OSGFkN0c5S0FJNVhWdWVCMDNkWmpWWlJjQTFPb2ZjRU1USUk0UkdvbzlPWi01akVUZW9MWXFaU1BIWDBlZjhjOWJnSUxKTVlpX2tn,4,,"Overall, this is a great app to use. The only minor complaint that I have is that it would be nice if the emotions had some kind of emoji or sticker attached to it. Its a nice way to visualize your moods as well. Also I feel it would give some people more incentive to stay on top of keeping track in addition to having the chart. Maybe have a chart that has the emojis on it so you can keep track of your moods that way.",undefined,undefined
gp:AOqpTOHTGVJ9O4UDconQ4dJjztr59FZeCccJsLjfz0RAcvfMLjTFqFgkvZsw7UD5hl2aSJBx-ySEpcCrHJGVNRs,heckn,https://lh5.googleusercontent.com/-3_5tbj8LjzY/AAAAAAAAAAI/AAAAAAAAUF0/UWci-O3UTfE/w96-h96-p/photo.jpg,"August 22, 2017",https://play.google.com/store/apps/details?id=arproductions.andrew.moodlog&reviewId=Z3A6QU9xcFRPSFRHVko5TzRVRGNvblE0ZEpqenRyNTlGWmVDY2NKc0xqZnowUkFjdmZNTGpURnFGZ2t2WnN3N1VENWhsMmFTSkJ4LXlTRXBjQ3JISkdWTlJz,5,,"Very good for tracking my emotions and moods. Was actually recommend to me by my therapist so I could see when I happened to hit any sort of depressed period in time. Has helped me get my emotions back onto a healthy track, thankful that an app like this exists.",undefined,undefined
gp:AOqpTOF33OPlTQyOZwvUyxBYmj0FNtebBB9Ef6_dB9H-xzzpXsCS7x6fNFCs4lBQFMmHrL-2nCK0zCmHVJcAapY,Danielle Maul,https://lh3.googleusercontent.com/-zLNJoI5lj8s/AAAAAAAAAAI/AAAAAAAAABo/Vc-WQCzJkrM/w96-h96-p/photo.jpg,"July 14, 2017",https://play.google.com/store/apps/details?id=arproductions.andrew.moodlog&reviewId=Z3A6QU9xcFRPRjMzT1BsVFF5T1p3dlV5eEJZbWowRk50ZWJCQjlFZjZfZEI5SC14enpwWHNDUzd4NmZORkNzNGxCUUZNbUhyTC0ybkNLMHpDbUhWSmNBYXBZ,5,,"I never write reviews but I am for this. I love it! Simple way to track my mood and I can make notes about what I was doing or thinking at that time. I also use the medications tab to track things like sleep and nicotine/alcohol consumption. In the tags I track my moods, where I am (work, home, ect.), and how bad my schizo symptoms are. I love it!",undefined,undefined
gp:AOqpTOFyHiKbUFTgvtwszi5kZLPY77j70zIqOYkn-1ZaEiZKSoFB_NRX8cNtzYlJIGjcuC3ce1N5Iv74FEpCEVs,Jon dixon,https://lh3.googleusercontent.com/-prbyn0RNdR0/AAAAAAAAAAI/AAAAAAAAGVg/FYC3YF-2fIs/w96-h96-p/photo.jpg,"July 27, 2017",https://play.google.com/store/apps/details?id=arproductions.andrew.moodlog&reviewId=Z3A6QU9xcFRPRnlIaUtiVUZUZ3Z0d3N6aTVrWkxQWTc3ajcweklxT1lrbi0xWmFFaVpLU29GQl9OUlg4Y050ellsSklHamN1QzNjZTFONUl2NzRGRXBDRVZz,4,,Great potential..needs a few updates.. 1)trigger button. Every time a trigger situation is encountered..to be able to input that would be a huge help! 2) would love to add diet components... Alcohol for example 3) interface isn't intuitive.  Great start for a potentially life altering product.,undefined,undefined
gp:AOqpTOG_wkSzv5U5rIaMfu4QdO8vyj397Aea9AD1iSS1jQ3v2PS5XuneqoDkSFiPoqTVmI9TkEp5pJPLpp5pioE,,https://lh5.googleusercontent.com/-2InBlASbHZ8/AAAAAAAAAAI/AAAAAAAAAAA/7KrEnftm85c/w96-h96-p/photo.jpg,"August 17, 2017",https://play.google.com/store/apps/details?id=arproductions.andrew.moodlog&reviewId=Z3A6QU9xcFRPR193a1N6djVVNXJJYU1mdTRRZE84dnlqMzk3QWVhOUFEMWlTUzFqUTN2MlBTNVh1bmVxb0RrU0ZpUG9xVFZtSTlUa0VwNXBKUExwcDVwaW9F,5,,"It's not clear which end of the scale is good. Is it blue or red? Am I rating my happiness or sadness? ---ok thanks for pointing out the settings! I changed the review. I actually tried three apps, but this one is private, and easier than others.","August 17, 2017","Thanks for trying Mood Log!
I left the scale open so that users can choose what they like best. I like to consider 0 as the worst possible mood and 10 as the best possible. There are also options for different scale colors in the settings.

Sincerely,
Andrew"
gp:AOqpTOFBbUroLNGRCiZg46ODk46KAt7L6Ob-LgPgW1Yc7jF5T9CZGIKqcvmikTdesuTo0MGfI7ya8fAvKhfXCpg,Thalia Peters,https://lh4.googleusercontent.com/-xrQckpFF_vQ/AAAAAAAAAAI/AAAAAAAACpE/zwx89WDSFvE/w96-h96-p/photo.jpg,"August 31, 2017",https://play.google.com/store/apps/details?id=arproductions.andrew.moodlog&reviewId=Z3A6QU9xcFRPRkJiVXJvTE5HUkNpWmc0Nk9EazQ2S0F0N0w2T2ItTGdQZ1cxWWM3akY1VDlDWkdJS3Fjdm1pa1RkZXN1VG8wTUdmSTd5YThmQXZLaGZYQ3Bn,4,,"I love this app - it's simple and useful and doesn't leave much to be desired. However, one small thing kept me from rating it five stars: I have been using this app to track the way my meds affect me emotionally throughout the day (in addition to long-term). Since I'm creating new entries three times a day if not more, it would be nice if there was some kind of zoom feature on the graph so you could track your mood over a single day or two, instead of a whole week (at the least). That way it would be easier to notice mood patterns based on the time of day. Other than that, this app is perfect and exactly what I was looking for. Thank you, Mood Log!","September 4, 2017","Thanks for using Mood log and for the kind words!
I see how being able to view moods over a shorter period of time could be really useful for seeing daily patterns. I'm going to look into adding that in one of the many updates I have planned for Mood Log's future.

Thanks for the feedback!
Sincerely,
Andrew"
gp:AOqpTOEvgn6MfJZZNsap3BZfTrZ1nFtK_XWB7rIGorCUlUcAhRqL4JJDRYsrvRptIQLGUvQYrN-WKXscDyChhhE,Gigi Colunga,https://lh4.googleusercontent.com/-t7dTvq6JIuA/AAAAAAAAAAI/AAAAAAAAAAA/ACSILjXInhG948JR6pmb_UXZVfpr82i7dw/w96-h96-p/photo.jpg,"July 10, 2017",https://play.google.com/store/apps/details?id=arproductions.andrew.moodlog&reviewId=Z3A6QU9xcFRPRXZnbjZNZkpaWk5zYXAzQlpmVHJaMW5GdEtfWFdCN3JJR29yQ1VsVWNBaFJxTDRKSkRSWXNydlJwdElRTEdVdlFZck4tV0tYc2NEeUNoaGhF,5,,Great app. Has helped me keep track of my different mood swings and length of my hipo manic and depresed episodes.,undefined,undefined
gp:AOqpTOG81B5ZukvFgrmp7ybrWckBNeLz8F6Oak4ghZgDQJlomk_iMc78TZWsvshCs8Hqsvr35cTbs0Ay6CMtk4I,Nirbhay Sen,https://lh4.googleusercontent.com/-_dEL_T09FAQ/AAAAAAAAAAI/AAAAAAAACJ4/4rmnsgnZnXU/w96-h96-p/photo.jpg,"July 26, 2017",https://play.google.com/store/apps/details?id=arproductions.andrew.moodlog&reviewId=Z3A6QU9xcFRPRzgxQjVadWt2RmdybXA3eWJyV2NrQk5lTHo4RjZPYWs0Z2haZ0RRSmxvbWtfaU1jNzhUWldzdnNoQ3M4SHFzdnIzNWNUYnMwQXk2Q010azRJ,5,,"After looking through tonnes of apps I felt this suited me best. It has a bunch of options that if you customise correctly can be much more comprehensive than any other offering. I use two numbering scales, one, the default for grading my mood, the other I put in tags to grade my energy levels. I use the medications option to keep track of sleep, exercise, space etc since I am not on medication. The statistics display is also better than some more popular apps. For me this is the best app available as I mentioned.",undefined,undefined
gp:AOqpTOElqttLYc9oA-zTNqZw_cOuCNJbXBgi7DABJAqyGyJsI_gsZe2d-ZCoK5A1f_5xBMy2sYB26-xekCAYTgA,,https://lh5.googleusercontent.com/-1kAR6M7V75o/AAAAAAAAAAI/AAAAAAAAAAA/NmGVjq_x5WU/w96-h96-p/photo.jpg,"July 2, 2017",https://play.google.com/store/apps/details?id=arproductions.andrew.moodlog&reviewId=Z3A6QU9xcFRPRWxxdHRMWWM5b0EtelROcVp3X2NPdUNOSmJYQmdpN0RBQkpBcXlHeUpzSV9nc1plMmQtWkNvSzVBMWZfNXhCTXkyc1lCMjYteGVrQ0FZVGdB,5,,This app has been wonderful! I have wanted to monitor my mood for a while but forget to write it down. With the reminder on my phone it's awesome and so easy!,undefined,undefined
gp:AOqpTOHPtcKj0EPBya2wVZEKZi2rDNnpJo8AJBKqLpFllsou6bGcpafT6ewbw2V28ZXSJgo6hQVdGFgo14ctMjI,,https://lh5.googleusercontent.com/-yBDMWgJ6MSE/AAAAAAAAAAI/AAAAAAAAAAA/4xneJ7gzxYc/w96-h96-p/photo.jpg,"July 20, 2017",https://play.google.com/store/apps/details?id=arproductions.andrew.moodlog&reviewId=Z3A6QU9xcFRPSFB0Y0tqMEVQQnlhMndWWkVLWmkyckRObnBKbzhBSkJLcUxwRmxsc291NmJHY3BhZlQ2ZXdidzJWMjhaWFNKZ282aFFWZEdGZ28xNGN0TWpJ,5,,I love it!  Helps me keep track of my mood swings daily and even few times daily.,undefined,undefined
gp:AOqpTOEv_MLn8NgnIMveZTTVLlopD4cvcy4Ewoj3bhedxxJesJ1IRxXhWMLlJKosWLBQhL4ANjPtJJ0oSJkdPRM,,https://lh4.googleusercontent.com/-XZo8AGlZ29o/AAAAAAAAAAI/AAAAAAAAAAA/njE2ADaocPY/w96-h96-p/photo.jpg,"October 2, 2017",https://play.google.com/store/apps/details?id=arproductions.andrew.moodlog&reviewId=Z3A6QU9xcFRPRXZfTUxuOE5nbklNdmVaVFRWTGxvcEQ0Y3ZjeTRFd29qM2JoZWR4eEplc0oxSVJ4WGhXTUxsSktvc1dMQlFoTDRBTmpQdEpKMG9TSmtkUFJN,4,,"Ideal for tracking moods/thoughts, I really like the fact that you can create your own mood tags. App is nice and simple. The one downside is that you can only set a maximum of 3 reminders a day, if it could be amended so that you can set as many reminders as you want, I'd give it 5 stars.",undefined,undefined
gp:AOqpTOHnNx5nliurSsAfx86Fnu9pAhiKLvi_FEpOGvJQfjV1TyLxVMzSD5dh62rt75nfemEEmEqHLsY0Bnmr-34,Kevin L Stephenson,https://lh4.googleusercontent.com/-33RcE6Jv4Vo/AAAAAAAAAAI/AAAAAAAABhs/NLpAgyKm-l0/w96-h96-p/photo.jpg,"October 10, 2017",https://play.google.com/store/apps/details?id=arproductions.andrew.moodlog&reviewId=Z3A6QU9xcFRPSG5OeDVubGl1clNzQWZ4ODZGbnU5cEFoaUtMdmlfRkVwT0d2SlFmalYxVHlMeFZNelNENWRoNjJydDc1bmZlbUVFbUVxSExzWTBCbm1yLTM0,5,,My therpasist wanted me tho start tracking my moods tip see when and what triggered my depression and of all the apps i have tried out this ones covers all the points i need to track,undefined,undefined
gp:AOqpTOF1djRCTxfylCkbjwE3q9HrpP_QzrJt1-mLGwj21ELAmS5_HK-W-GPhHxKnVVy0Ey0ODoq72FQWgwvjYnU,dearIy,https://lh6.googleusercontent.com/-hYFGN5E9V_w/AAAAAAAAAAI/AAAAAAAAAGE/SejQWcP7E6U/w96-h96-p/photo.jpg,"June 11, 2017",https://play.google.com/store/apps/details?id=arproductions.andrew.moodlog&reviewId=Z3A6QU9xcFRPRjFkalJDVHhmeWxDa2Jqd0UzcTlIcnBQX1F6ckp0MS1tTEd3ajIxRUxBbVM1X0hLLVctR1BoSHhLblZWeTBFeTBPRG9xNzJGUVdnd3ZqWW5V,5,,i've been trying to find a good app for tracking moods;; this one i highly recommend! i don't think i'll be uninstalling this one anytime soon.,undefined,undefined
