id,userName,userImage,date,url,score,title,text,replyDate,replyText
gp:AOqpTOH3yyLbIs2Ybud2xCGonRvWsdgfjV4eYq8OhdvG2dLM6dR4_LACFAbWkbgr8JPcjn64oOJlPsB71y33B1Y,,https://lh3.googleusercontent.com/-z6cBI4WiaQ8/AAAAAAAAAAI/AAAAAAAAAAA/Mlv1mRU5Pdc/w96-h96-p/photo.jpg,"December 21, 2017",https://play.google.com/store/apps/details?id=com.journey.mood&reviewId=Z3A6QU9xcFRPSDN5eUxiSXMyWWJ1ZDJ4Q0dvblJ2V3NkZ2ZqVjRlWXE4T2hkdkcyZExNNmRSNF9MQUNGQWJXa2JncjhKUGNqbjY0b09KbFBzQjcxeTMzQjFZ,5,,It has been of great help......!.....Its good to be able to record my daily thoughts and mood because I have learned things about myself or situations when reflecting on these notes! Thanks!,undefined,undefined
gp:AOqpTOFz-mriZqwz86PvHoqbsVYKk5-QvhSrK7GWGn2_F9pdW8V2P7GDKx_HPeYJIPGJe0iQSrqaLvNiQ29EItc,Cindy Urena,https://lh5.googleusercontent.com/-rLiDTE0IblY/AAAAAAAAAAI/AAAAAAAAAAA/ACSILjVIM18S0z2xYTAqfIPf2z_fBY4emg/w96-h96-p/photo.jpg,"June 7, 2017",https://play.google.com/store/apps/details?id=com.journey.mood&reviewId=Z3A6QU9xcFRPRnotbXJpWnF3ejg2UHZIb3Fic1ZZS2s1LVF2aFNySzdHV0duMl9GOXBkVzhWMlA3R0RLeF9IUGVZSklQR0plMGlRU3JxYUx2TmlRMjlFSXRj,5,,"This is exactly what I was looking for , even though I paid for your other app journal for the same developer it's ok because it's so worth it . I want to thank you so much , it's elegant simple tools  and very easy to use . I love it .","June 8, 2017","Hi Cindy, thank you for supporting us! We are glad that you like it :)"
gp:AOqpTOH5MPFyM2MNLUsk3ANTkX4MUx9cxZ30RzV7JRugxuoX1DBwl8dXLV_sUGnr0rlLWjpuYOG_jpsHvXCG5Dw,Ka Rin,https://lh3.googleusercontent.com/-9GWE0Gg1jeM/AAAAAAAAAAI/AAAAAAAAACo/OJEX6Ukz5T8/w96-h96-p/photo.jpg,"December 6, 2017",https://play.google.com/store/apps/details?id=com.journey.mood&reviewId=Z3A6QU9xcFRPSDVNUEZ5TTJNTkxVc2szQU5Ua1g0TVV4OWN4WjMwUnpWN0pSdWd4dW9YMURCd2w4ZFhMVl9zVUducjBybExXanB1WU9HX2pwc0h2WENHNUR3,4,,"Looks like a clone of Daylio, but I like the simple design. Please add more icons, a Google drive backup and most important a dark mode (triggered by time if possible)",undefined,undefined
gp:AOqpTOEFZa8RrrFRANY5XbEk0j1oj8nzJq2xpy5FhbLXyuOCED3_Q2pnIhzY6e6pxKxiGJ2f4W6HWdeMw1Xuyuw,Amitabha Majumdar,https://lh4.googleusercontent.com/-pf6Sft1-0r0/AAAAAAAAAAI/AAAAAAAAAPg/e4hU4zcSyeU/w96-h96-p/photo.jpg,"August 28, 2017",https://play.google.com/store/apps/details?id=com.journey.mood&reviewId=Z3A6QU9xcFRPRUZaYThScnJGUkFOWTVYYkVrMGoxb2o4bnpKcTJ4cHk1RmhiTFh5dU9DRUQzX1EycG5JaHpZNmU2cHhLeGlHSjJmNFc2SFdkZU13MVh1eXV3,4,,"It's a great app as a personal diary and mood tracker. It has a very cute and simple UI. But it would be nice if you add a daily and yearly mood chart like Daylio. Otherwise, it's great!","August 28, 2017",Thank you for your support! :)
gp:AOqpTOHt6SEfHpQapsPSoia3Ko-gTkcVRCSnPzOzD9h0cX8wzri6weXyqh_CN2Lx1sY3riRralWJFJ0s49MrxAs,Kirstein Powell,https://lh4.googleusercontent.com/-NP0smMxrM_w/AAAAAAAAAAI/AAAAAAAAVis/voMd86J9-t8/w96-h96-p/photo.jpg,"August 6, 2017",https://play.google.com/store/apps/details?id=com.journey.mood&reviewId=Z3A6QU9xcFRPSHQ2U0VmSHBRYXBzUFNvaWEzS28tZ1RrY1ZSQ1NuUHpPekQ5aDBjWDh3enJpNndlWHlxaF9DTjJMeDFzWTNyaVJyYWxXSkZKMHM0OU1yeEFz,4,,A good little app.  Helps me to track mood over time and why.  Should help with therapy.,"August 8, 2017",Thank you Kirstein!
gp:AOqpTOHy3uhSeXQ14Awall__ssag04kqbqyI_iU_CIn09FHGpoxO6Pe-bR1fNczzE5ZFScHOtBVWNh0Q27phQno,Meranda Percell,https://lh3.googleusercontent.com/-T8YzFDRd2As/AAAAAAAAAAI/AAAAAAAAAAA/ACSILjVHZ3HENVZnW_0Wi5kIQxGRVNJu2Q/w96-h96-p/photo.jpg,"December 3, 2017",https://play.google.com/store/apps/details?id=com.journey.mood&reviewId=Z3A6QU9xcFRPSHkzdWhTZVhRMTRBd2FsbF9fc3NhZzA0a3FicXlJX2lVX0NJbjA5RkhHcG94TzZQZS1iUjFmTmN6ekU1WkZTY0hPdEJWV05oMFEyN3BoUW5v,5,,Just the app I was looking for but needs more emojis like one for crying,undefined,undefined
gp:AOqpTOHY-IH8YTC1QIud-rSYrJA87U-6keqIMGnxPJWHk-NuPscBNPNTstB1u1GpD1qLwQbwUHUsw2GHJIIcG14,Rushi Chincholkar,https://lh6.googleusercontent.com/-K8svMES12Fg/AAAAAAAAAAI/AAAAAAAACYE/L2e6pfob6eA/w96-h96-p/photo.jpg,"August 1, 2017",https://play.google.com/store/apps/details?id=com.journey.mood&reviewId=Z3A6QU9xcFRPSFktSUg4WVRDMVFJdWQtclNZckpBODdVLTZrZXFJTUdueFBKV0hrLU51UHNjQk5QTlRzdEIxdTFHcEQxcUx3UWJ3VUhVc3cyR0hKSUljRzE0,5,,The app is great. The mood prediction feature works well too. The ability of taking my entries in journey app is also wonderful.   Please add option to search for keywords. The feature is there in Journey app made by you.,"August 1, 2017","Hello Rushi, thank you for your continued support! :)"
gp:AOqpTOE8ZS8ttpU5EOWkoHjy1hC2H_rPX7KVz2baAdeN6Ia0Xz5DObJWB7hvmwS0c3YZmIQfhvdzk0cxByPjZsw,Markos Michalatos,https://lh5.googleusercontent.com/-i4cZhb2aWd0/AAAAAAAAAAI/AAAAAAAAAAA/ACSILjVTnKBeS7Cyaw2SP-gEACJeuksXiQ/w96-h96-p/photo.jpg,"September 27, 2017",https://play.google.com/store/apps/details?id=com.journey.mood&reviewId=Z3A6QU9xcFRPRThaUzh0dHBVNUVPV2tvSGp5MWhDMkhfclBYN0tWejJiYUFkZU42SWEwWHo1RE9iSldCN2h2bXdTMGMzWVptSVFmaHZkemswY3hCeVBqWnN3,5,,Feature request:  Integrate good and bad habit tracking into the app?  The option to search keywords throughout the whole data?,undefined,undefined
