id,userName,userImage,date,url,score,title,text,replyDate,replyText
gp:AOqpTOEINKz1pw8msGuNIRQbuH286kPzDxF-vRtPEcnc8YdvvsDtcbojlV3tCWYozZ0N0Fu07C8uaO0KM8IjNfY,Alyson Zepeda,https://lh4.googleusercontent.com/-Vs5kreURTnM/AAAAAAAAAAI/AAAAAAAABhE/QAy2km7O7DQ/w96-h96-p/photo.jpg,"December 16, 2017",https://play.google.com/store/apps/details?id=com.TailoredMusic.RainyMood&reviewId=Z3A6QU9xcFRPRUlOS3oxcHc4bXNHdU5JUlFidUgyODZrUHpEeEYtdlJ0UEVjbmM4WWR2dnNEdGNib2psVjN0Q1dZb3paME4wRnUwN0M4dWFPMEtNOElqTmZZ,5,,"I've used Rainy Mood for years online for free. I love it so much that today I decided I really needed to find a way to give them money for all the years of better sleep,  focus, and general cozy feels. <3 The best rain sounds available, by orders of magnitude. No one else comes close. Protip: play Rainy Mood Classic over Bach Cello Suites (all of them, but especially #1.)",undefined,undefined
gp:AOqpTOEll4zbK81qFzvBZ3O0063lnZUzLA7eioTXsop0HucjosT2mPmLyltdgEbXE6Ycwh3LE5iL4A47t2pqLcw,Brian Banks,https://lh5.googleusercontent.com/-UPrwiRMLr0M/AAAAAAAAAAI/AAAAAAAAO5c/e_A2N-Df2ao/w96-h96-p/photo.jpg,"December 21, 2017",https://play.google.com/store/apps/details?id=com.TailoredMusic.RainyMood&reviewId=Z3A6QU9xcFRPRWxsNHpiSzgxcUZ6dkJaM08wMDYzbG5aVXpMQTdlaW9UWHNvcDBIdWNqb3NUMm1QbUx5bHRkZ0ViWEU2WWN3aDNMRTVpTDRBNDd0MnBxTGN3,3,,"The sounds are wonderful, calming, and beneficial to sleep, much like the desktop site but with customizability.   However, I keep having challenges:  Sometimes the sound will stop in the middle of the night then I can't get it to play again until I reboot the phone.  Sometimes the sounds will keep playing after the app is closed.  Sometimes (even though the rain was stopped normally and the app is closed) I get rain every time I start an Audible book or music, then it stops when I turn off the music/book.  I have a Galaxy S7",undefined,undefined
gp:AOqpTOHce_UwrkkY-JSu9GfQFlAmQy8a9AQJi1VNdSM74zm2yXKHfoC3iFUJwxuW7uOFMxODaXRNs9o8C9bFqEI,Cyn Forrester,https://lh4.googleusercontent.com/-24QLfWUHYzE/AAAAAAAAAAI/AAAAAAAAEU0/D8hZyiajg2k/w96-h96-p/photo.jpg,"January 29, 2018",https://play.google.com/store/apps/details?id=com.TailoredMusic.RainyMood&reviewId=Z3A6QU9xcFRPSGNlX1V3cmtrWS1KU3U5R2ZRRmxBbVF5OGE5QVFKaTFWTmRTTTc0em0yeVhLSGZvQzNpRlVKd3h1Vzd1T0ZNeE9EYVhSTnM5bzhDOWJGcUVJ,5,,"Been a huge fan of Rainy Mood since I discovered it free years ago as a website. When it came out with an app, I just had to get it! Beautifully made! I do agree with Eric, that having a more optimized volume control would be awesome with other playlists.",undefined,undefined
gp:AOqpTOEXFEpZ-QHfSEWO6Hd6IgpPNj3KFYH10hUoGoXu0q-kIX61fZTUPns07vzHuvC7L6wdguQizzLi_TbB97k,Eric Du,https://lh3.googleusercontent.com/-bG6r_VUwn6c/AAAAAAAAAAI/AAAAAAAAAVc/vVT_52PuyuE/w96-h96-p/photo.jpg,"December 13, 2017",https://play.google.com/store/apps/details?id=com.TailoredMusic.RainyMood&reviewId=Z3A6QU9xcFRPRVhGRXBaLVFIZlNFV082SGQ2SWdwUE5qM0tGWUgxMGhVb0dvWHUwcS1rSVg2MWZaVFVQbnMwN3Z6SHV2QzdMNndkZ3VRaXp6TGlfVGJCOTdr,4,,"my only complaint is that you can't raise the volume of the rain any higher. There are times where the rain gets too quiet or the playlist I have is calming, but gets a bit too loud, so I have difficulty hearing the rain. Unlike the desktop version, I van't just open a sound mixer and fix it that way, so if it were possible to up the volume of the rain, I'd just love it even more.  Anyways, the app is great though, if you want just the rain sound effect, and are having trouble focusing on some work, or sleep, or whatever, this is honestly worth a shot. You can try the desktop version, see how you like it, then decide if you want this.","December 14, 2017","Thanks for the love, Eric and for supporting Rainy Mood! ðŸ˜™  I appreciate your detailed feedback. Many pluviophiles are audiophiles too so will look for ways to improve the mix."
gp:AOqpTOGW8gcs9D7m3Zafax1b57PRE98gAFTtaybAnErF8uFqe-GHufCmSyclpsDYtGSH2CqkS8x7Qltt6sl6Eh8,,https://lh3.googleusercontent.com/-cCJi1LIsODc/AAAAAAAAAAI/AAAAAAAAAKs/vEVO-7fueoU/w96-h96-p/photo.jpg,"December 16, 2017",https://play.google.com/store/apps/details?id=com.TailoredMusic.RainyMood&reviewId=Z3A6QU9xcFRPR1c4Z2NzOUQ3bTNaYWZheDFiNTdQUkU5OGdBRlR0YXliQW5FckY4dUZxZS1HSHVmQ21TeWNscHNEWXRHU0gyQ3FrUzh4N1FsdHQ2c2w2RWg4,5,,"This app is incredible! I have always loved the rain. I don't think there is anything quite as therapeutic. Rainy Mood gives me that experience when I'm sleeping, writing, reading, and relaxing. So thankful for the developers and the many options, especially the timer. What a gift!! It's a must have, and I'm always happy to share it with other rain lovers!",undefined,undefined
gp:AOqpTOGQdEYa9GUJjIu1mxnKJWSrIIP09ow7O0xEinEuOwXoxkEEKtVZa9fi1Woe0goGRVJ8qiuVS7pT4C4_gi4,Crystal M,https://lh5.googleusercontent.com/-6sw6pCShLGI/AAAAAAAAAAI/AAAAAAAANzE/pg_9DeSDJfo/w96-h96-p/photo.jpg,"January 9, 2018",https://play.google.com/store/apps/details?id=com.TailoredMusic.RainyMood&reviewId=Z3A6QU9xcFRPR1FkRVlhOUdVSmpJdTFteG5LSldTcklJUDA5b3c3TzB4RWluRXVPd1hveGtFRUt0VlphOWZpMVdvZTBnb0dSVko4cWl1VlM3cFQ0QzRfZ2k0,5,,"I've tried quite a few rain apps over the years but this one is actually worth the $3 or however much it is, the sound quality is amazing, it actually sounds realistic! I've always had to cycle between different rain settings on other apps and half of them would just sound like white noise. I definitely recommend ðŸ‘",undefined,undefined
gp:AOqpTOHnsjJAg1DrTWeK4Qj_K_kRcDA48OKeQD4cij8xzfJjjrRtfrdzTOihGaF6t6e8shJcPcmDJCgbsriPL-M,Sam Patterson,https://lh3.googleusercontent.com/-KjOhxjS8SvM/AAAAAAAAAAI/AAAAAAAAEP4/wtPasZuHeiM/w96-h96-p/photo.jpg,"January 4, 2018",https://play.google.com/store/apps/details?id=com.TailoredMusic.RainyMood&reviewId=Z3A6QU9xcFRPSG5zakpBZzFEclRXZUs0UWpfS19rUmNEQTQ4T0tlUUQ0Y2lqOHh6ZkpqanJSdGZyZHpUT2loR2FGNnQ2ZThzaEpjUGNtREpDZ2JzcmlQTC1N,5,,Edit for update 4.2: I'm so happy about the new timer it's perfect.  Helps me fall asleep but I wish I could set the sleep timer. Sometimes one hour isn't enough time and it shutting off jolts me right back awake again,undefined,undefined
gp:AOqpTOFUwxMl4PQaQzMuZFbSqNpuRoctGycL9nERFo6vLZKAPcf0_DZCkHZgwlzlhq4TSfNSVm5kvTAdOsT3JIM,Brendan Snowball,https://lh4.googleusercontent.com/-oW2ZdgdP4_0/AAAAAAAAAAI/AAAAAAAAAB4/fsuG4VJFc94/w96-h96-p/photo.jpg,"December 11, 2017",https://play.google.com/store/apps/details?id=com.TailoredMusic.RainyMood&reviewId=Z3A6QU9xcFRPRlV3eE1sNFBRYVF6TXVaRmJTcU5wdVJvY3RHeWNMOW5FUkZvNnZMWktBUGNmMF9EWkNrSFpnd2x6bGhxNFRTZk5TVm01a3ZUQWRPc1QzSklN,5,,"As an insomniac almost nothing actually helps,me fall asleep. White noice just gives me a headache. I used the desktop version for a long time. This is icing. With my room stereo I get an immersive feeling that is super comforting. Thank you RainyMood. A++++++++",undefined,undefined
gp:AOqpTOH3U64gNknuXCkcWb3gWRfwSjn63jJOuYkMQ30XQ9QSswSE_fomNWN3SL2emzhEJaonzi_WfyrkgoXXMZo,Marko Ljuboja,https://lh3.googleusercontent.com/-WoanvdesRR4/AAAAAAAAAAI/AAAAAAAAAAA/ACSILjWX56WwtvaRqY137Skt-JXlOfUR_g/w96-h96-p/photo.jpg,"November 30, 2017",https://play.google.com/store/apps/details?id=com.TailoredMusic.RainyMood&reviewId=Z3A6QU9xcFRPSDNVNjRnTmtudVhDa2NXYjNnV1Jmd1NqbjYzakpPdVlrTVEzMFhROVFTc3dTRV9mb21OV04zU0wyZW16aEVKYW9uemlfV2Z5cmtnb1hYTVpv,4,,"I'm not sure if it's my headphones or my phone but I keep hearing faint music in the background. It's like I'm picking up a radio station. Anyway, that out of the way, the app is awesome, it's like someone shoots a tranquilizer dart in my ass. Suggestion, in addition to lowering/raising volume of thunder, also add frequency.",undefined,undefined
gp:AOqpTOH6FyFFPMsrIznrOKSIaQEKYiQbWhLVvV3oq1Ad9ijW4J4A54r0QKsRkGqHDPYb0QdDOi19Z7NN2A-4FTw,,https://lh4.googleusercontent.com/-4h9jt8Iolqw/AAAAAAAAAAI/AAAAAAAAAAA/_Wy4acooWsY/w96-h96-p/photo.jpg,"January 3, 2018",https://play.google.com/store/apps/details?id=com.TailoredMusic.RainyMood&reviewId=Z3A6QU9xcFRPSDZGeUZGUE1zckl6bnJPS1NJYVFFS1lpUWJXaExWdlYzb3ExQWQ5aWpXNEo0QTU0cjBRS3NSa0dxSERQWWIwUWRET2kxOVo3Tk4yQS00RlR3,3,,"I love the idea of this app and what I've heard so far sounds good.  But I recently used it to try and get some sleep on a long flight.  With my phone in airplane mode, it went from 90% battery life to less than 50% in a couple of hours.  Upon reflection, this app does more than just play a simple audio track.  So, I guess I should expect it to use more power than Google Play.  But this seems excessive.",undefined,undefined
gp:AOqpTOG-zkugDluwJ-_Yft3H9dHFAys3RmWxv2DNlDnuv_5NN2_diwMPrYCKwym0XAY2Yv8bRgoABINQyVGri5A,,https://lh4.googleusercontent.com/-q8Bk-TLZgJQ/AAAAAAAAAAI/AAAAAAAAAAA/BYayR5U19GU/w96-h96-p/photo.jpg,"February 4, 2018",https://play.google.com/store/apps/details?id=com.TailoredMusic.RainyMood&reviewId=Z3A6QU9xcFRPRy16a3VnRGx1d0otX1lmdDNIOWRIRkF5czNSbVd4djJETmxEbnV2XzVOTjJfZGl3TVByWUNLd3ltMFhBWTJZdjhiUmdvQUJJTlF5VkdyaTVB,2,,"The rain needs to be louder! Pandora music totally overpowers the rain sound, which defeats my purpose of downloading the app to play both. Only advantageous feature is the sleep timer. Not worth it- stick with the website!",undefined,undefined
gp:AOqpTOE2BYLA6Es0h0L22pdQnOA3TF1NFPhIZ8bXJRS1IFwDgcn2zfAI6LmjAN-0hUIvc3orZzjbTryuCnFC1t4,Jimmy Payne,https://lh3.googleusercontent.com/-2wYfIErnpes/AAAAAAAAAAI/AAAAAAAAAAA/ACSILjWIDchTnL-GGhVwdulhCpUijoXvUQ/w96-h96-p/photo.jpg,"January 9, 2018",https://play.google.com/store/apps/details?id=com.TailoredMusic.RainyMood&reviewId=Z3A6QU9xcFRPRTJCWUxBNkVzMGgwTDIycGRRbk9BM1RGMU5GUGhJWjhiWEpSUzFJRndEZ2NuMnpmQUk2TG1qQU4tMGhVSXZjM29yWnpqYlRyeXVDbkZDMXQ0,5,,Love that this is an app now! Only way i can sleep is with my rainy mood! Would suggest making a skill for the amazon alexa so you can prompt it to play rainy mood for you without draining phone battery so much,undefined,undefined
gp:AOqpTOG6X7pm39HEZ-rdS8-YnawtZdCCzCXYbR5nTjZRNlZvm7sf-b8fEdAq8dhXmAk1OHxuXSQG9Tc09wAbDfQ,David Marley,https://lh3.googleusercontent.com/-LgDMXro_ZIc/AAAAAAAAAAI/AAAAAAAAAEc/oPKx2kxoQDk/w96-h96-p/photo.jpg,"January 24, 2018",https://play.google.com/store/apps/details?id=com.TailoredMusic.RainyMood&reviewId=Z3A6QU9xcFRPRzZYN3BtMzlIRVotcmRTOC1ZbmF3dFpkQ0N6Q1hZYlI1blRqWlJObFp2bTdzZi1iOGZFZEFxOGRoWG1BazFPSHh1WFNRRzlUYzA5d0FiRGZR,3,,"Love this app, only thing missing to make it 5 stars is a push to google home/chromecast button. Pretty well all other apps have that these days if it's useful",undefined,undefined
gp:AOqpTOExLwEx25WmlQpRp69Ry6kLndeezyP6m8MBKupkpgOlihOT47z40QIPWmVFeWGG3kK_vYiCxcSYIRaGSK8,Adam Kern,https://lh5.googleusercontent.com/-4LRzviG0rdA/AAAAAAAAAAI/AAAAAAAAANg/loZm4jp6dKM/w96-h96-p/photo.jpg,"December 21, 2017",https://play.google.com/store/apps/details?id=com.TailoredMusic.RainyMood&reviewId=Z3A6QU9xcFRPRXhMd0V4MjVXbWxRcFJwNjlSeTZrTG5kZWV6eVA2bThNQkt1cGtwZ09saWhPVDQ3ejQwUUlQV21WRmVXR0cza0tfdllpQ3hjU1lJUmFHU0s4,4,,"I love the app, but would really like the return of the feature where the timer runs out and the app closes. When I wake up I have to close the app. Not a big deal, but it was a nice feature back in the day.",undefined,undefined
gp:AOqpTOFkKLBJjUkowPFok0GwiYbfByvFmJLdf3Re489GlgP8o5xcsRy3D7J9jjQyhMXOoPkqw34GmzGU6onsJKc,Wednesday Mac,https://lh4.googleusercontent.com/-yN_oKeKj72g/AAAAAAAAAAI/AAAAAAAAKjI/iKGCFdhxoAc/w96-h96-p/photo.jpg,"December 25, 2017",https://play.google.com/store/apps/details?id=com.TailoredMusic.RainyMood&reviewId=Z3A6QU9xcFRPRmtLTEJKalVrb3dQRm9rMEd3aVliZkJ5dkZtSkxkZjNSZTQ4OUdsZ1A4bzV4Y3NSeTNEN0o5ampReWhNWE9vUGtxdzM0R216R1U2b25zSktj,5,,"Love love love this app. And the website. Would listen to the rain all night if I could, as I live in an area that gets far too little rain, and I miss it terribly.",undefined,undefined
gp:AOqpTOEENDmwJbj82NLvm6dxvCQXVDcr96Did40eSGoJ3CIzZCv2SSLGAZlCO41LOpnqWVS0C_ao3-MwKwRAsd4,Rachel Orf,https://lh4.googleusercontent.com/-GeIvmeWh_W0/AAAAAAAAAAI/AAAAAAAAEBM/3c5WpVRF_IE/w96-h96-p/photo.jpg,"January 5, 2018",https://play.google.com/store/apps/details?id=com.TailoredMusic.RainyMood&reviewId=Z3A6QU9xcFRPRUVORG13SmJqODJOTHZtNmR4dkNRWFZEY3I5NkRpZDQwZVNHb0ozQ0l6WkN2MlNTTEdBWmxDTzQxTE9wbnFXVlMwQ19hbzMtTXdLd1JBc2Q0,2,,"Slowed down my phone. Froze and crashed multiple times, making me turn off my phone. Good concept, poor app.",undefined,undefined
gp:AOqpTOHY3ejRwBQB6QBPn3wL-J6RfP94PHmtSA8fbCGp3ngODUzxvy1xDxT5XQDzeyMQwD17ZTNh5QOSWCgRswk,superwolf allen,https://lh4.googleusercontent.com/-_sIxH22D5a0/AAAAAAAAAAI/AAAAAAAAAJc/cADQgS5fxEE/w96-h96-p/photo.jpg,"December 28, 2017",https://play.google.com/store/apps/details?id=com.TailoredMusic.RainyMood&reviewId=Z3A6QU9xcFRPSFkzZWpSd0JRQjZRQlBuM3dMLUo2UmZQOTRQSG10U0E4ZmJDR3AzbmdPRFV6eHZ5MXhEeFQ1WFFEemV5TVF3RDE3WlROaDVRT1NXQ2dSc3dr,5,,I've been listening to the free internet version the last weeks to study for my tests and it helped so much to focus! I thought it's worth to spent money on that to help improving this app! I love this app as much as I love the sound of rain â¤,undefined,undefined
gp:AOqpTOG09WCBffVTX_R6yg63LBWrYh6RcWi0a6WFG7Fe0zRllq6JwMGjSQbapLk-naiw5_52V1TJYFYYt1j8dH0,Steven Goates,https://lh4.googleusercontent.com/-SAH9bUMxlmQ/AAAAAAAAAAI/AAAAAAAAAEU/HMcsemjBkH4/w96-h96-p/photo.jpg,"January 7, 2018",https://play.google.com/store/apps/details?id=com.TailoredMusic.RainyMood&reviewId=Z3A6QU9xcFRPRzA5V0NCZmZWVFhfUjZ5ZzYzTEJXclloNlJjV2kwYTZXRkc3RmUwelJsbHE2SndNR2pTUWJhcExrLW5haXc1XzUyVjFUSllGWVl0MWo4ZEgw,2,,What's the point of an app that uses three times the battery of a free web service? It seems I should have just kept using the rainy mood website on my phone. Way less battery usage.,undefined,undefined
gp:AOqpTOFE7kVSZ8kTXeeHvECq6AoLCIdRQlQB0hdYqn1P5JlJnyArY-piy008t9rlRxtZORR3swN7fjbTGwv40M0,Caboose1396,https://lh4.googleusercontent.com/-oPL3TmBOIpI/AAAAAAAAAAI/AAAAAAAAAAA/ACSILjXZkb-8Slhur1S6i5q38yZkxb2gvQ/w96-h96-p/photo.jpg,"January 21, 2018",https://play.google.com/store/apps/details?id=com.TailoredMusic.RainyMood&reviewId=Z3A6QU9xcFRPRkU3a1ZTWjhrVFhlZUh2RUNxNkFvTENJZFJRbFFCMGhkWXFuMVA1SmxKbnlBclktcGl5MDA4dDlybFJ4dFpPUlIzc3dON2ZqYlRHd3Y0ME0w,5,,"Works phenomenally, different scenery options for sound variation, if that's what you're into. Couldn't be more pleased with app. Works with Pandora running as well.",undefined,undefined
gp:AOqpTOH1phumt5zYn9W1izv9xGkc0C17EJfFFifCIaxyEq9Kany73hhhBlOt_srYB692j6LxQgS_aiCRyQX4sAs,Nwonknu Resu,https://lh6.googleusercontent.com/-QQWCS-bMvpE/AAAAAAAAAAI/AAAAAAAAABE/yd5ZKrwoOsc/w96-h96-p/photo.jpg,"December 12, 2017",https://play.google.com/store/apps/details?id=com.TailoredMusic.RainyMood&reviewId=Z3A6QU9xcFRPSDFwaHVtdDV6WW45VzFpenY5eEdrYzBDMTdFSmZGRmlmQ0lheHlFcTlLYW55NzNoaGhCbE90X3NyWUI2OTJqNkx4UWdTX2FpQ1J5UVg0c0Fz,5,,"One of the greatest app, I hadn't be able to sleep or concentrate before Rainy Mood. Worth every single penny",undefined,undefined
gp:AOqpTOHDsIA6NQoJ1kWFzzS_R3wW2EGhL7PEVOxC3z7JIM_u28eOtyNEEH7SFI5rWNNCeHin6_jnJTl50rWUlBA,Kumar Gaurav,https://lh3.googleusercontent.com/-Dh_KMoom-ik/AAAAAAAAAAI/AAAAAAAAFIE/pSpeYdGMltY/w96-h96-p/photo.jpg,"January 31, 2018",https://play.google.com/store/apps/details?id=com.TailoredMusic.RainyMood&reviewId=Z3A6QU9xcFRPSERzSUE2TlFvSjFrV0Z6elNfUjN3VzJFR2hMN1BFVk94QzN6N0pJTV91MjhlT3R5TkVFSDdTRkk1cldOTkNlSGluNl9qbkpUbDUwcldVbEJB,4,,Unable to turn ON or turn OFF sound via headphone. Please update the app and include the controlling features like we have in regular music app.,undefined,undefined
gp:AOqpTOGO3kfeAGla14WsFJnCLU624yDqistArjDETw_1vdM4gGjwFsMIp7kGPs8gY4tqcQku0xLtI7tZvlSSpsk,Thomas Bubendorfer,https://lh3.googleusercontent.com/-NroD4J1ddGA/AAAAAAAAAAI/AAAAAAAAF_s/8WW5poE4Zns/w96-h96-p/photo.jpg,"December 31, 2017",https://play.google.com/store/apps/details?id=com.TailoredMusic.RainyMood&reviewId=Z3A6QU9xcFRPR08za2ZlQUdsYTE0V3NGSm5DTFU2MjR5RHFpc3RBcmpERVR3XzF2ZE00Z0dqd0ZzTUlwN2tHUHM4Z1k0dHFjUWt1MHhMdEk3dFp2bFNTcHNr,5,,"Brilliant! Love the different options and customisable sound levels, as I used to be a user of the website. I love the sleep timer, but I wish there was a one for the cafe as that is my favorite. I'm not removing any stars for that though!",undefined,undefined
gp:AOqpTOGcRO8EdZwe5e5CVWpdCTvnX4LnxtgKEab582KEwyd5f6SWon5YCs3zypAGvC-LSP9O3XrnGWdk20hNofA,Tom Osborn,https://lh3.googleusercontent.com/-Wy7CGKUq-Xg/AAAAAAAAAAI/AAAAAAAAAI0/YC8wd-O8Szo/w96-h96-p/photo.jpg,"January 11, 2018",https://play.google.com/store/apps/details?id=com.TailoredMusic.RainyMood&reviewId=Z3A6QU9xcFRPR2NSTzhFZFp3ZTVlNUNWV3BkQ1R2blg0TG54dGdLRWFiNTgyS0V3eWQ1ZjZTV29uNVlDczN6eXBBR3ZDLUxTUDlPM1hybkdXZGsyMGhOb2ZB,4,,I would love an in car or in tent mode. Or a way to turn your current options to interior so you're hearing from inside.,undefined,undefined
gp:AOqpTOGBBDBNjxOo3gbrs9AtEH-bPlSJQl5CFyHpUaCqDiGzEAUBfznkiL215aD7Flwips1W7KR0WLU99u0HCsg,Benjamyn Buchanan,https://lh5.googleusercontent.com/-pPSjYAl2AdM/AAAAAAAAAAI/AAAAAAAAB6E/8abcQHrnv5c/w96-h96-p/photo.jpg,"December 13, 2017",https://play.google.com/store/apps/details?id=com.TailoredMusic.RainyMood&reviewId=Z3A6QU9xcFRPR0JCREJOanhPbzNnYnJzOUF0RUgtYlBsU0pRbDVDRnlIcFVhQ3FEaUd6RUFVQmZ6bmtpTDIxNWFEN0Zsd2lwczFXN0tSMFdMVTk5dTBIQ3Nn,5,,It's raining. It's pouring. The app is great for so sleeping and hanging out!,"December 14, 2017","ðŸ˜˜  Thanks for the stellar five star review, Benjamyn! So glad to hear Rainy Mood works for you. â›ˆ

Let the rain kiss you
Let the rain beat upon your head with silver liquid drops
Let the rain sing you a lullaby

        --Langston Hughes"
gp:AOqpTOGdq_Drq4yzilCPbP4UuK0SzGh0YO2InjfwOEbhRctEhjWZgd0G7hkG1LQ2WunbINNnA79dHBZf_kn6I5Y,Sydney M,https://lh6.googleusercontent.com/-5GRAUVCQTr4/AAAAAAAAAAI/AAAAAAAAAGU/_P7bnhVQrQE/w96-h96-p/photo.jpg,"January 16, 2018",https://play.google.com/store/apps/details?id=com.TailoredMusic.RainyMood&reviewId=Z3A6QU9xcFRPR2RxX0RycTR5emlsQ1BiUDRVdUswU3pHaDBZTzJJbmpmd09FYmhSY3RFaGpXWmdkMEc3aGtHMUxRMld1bmJJTk5uQTc5ZEhCWmZfa242STVZ,5,,"This really helps me sleep. If you need some noise to help relax, this is by far the best.",undefined,undefined
gp:AOqpTOG2uVsCFeDobcxWKdnm5rsMU2YRYijPWKwq6WJQ5rBj-jDBMIro0HK4MIb_Vx71B70IBbzRinDYV3ItRuA,Kara Willis,https://lh4.googleusercontent.com/-9LPezA9vQjU/AAAAAAAAAAI/AAAAAAAAATU/dPHDZm5VJTY/w96-h96-p/photo.jpg,"January 27, 2018",https://play.google.com/store/apps/details?id=com.TailoredMusic.RainyMood&reviewId=Z3A6QU9xcFRPRzJ1VnNDRmVEb2JjeFdLZG5tNXJzTVUyWVJZaWpQV0t3cTZXSlE1ckJqLWpEQk1Jcm8wSEs0TUliX1Z4NzFCNzBJQmJ6UmluRFlWM0l0UnVB,5,,I have used rainymood for years to help me sleep. Love the app because ot lets me adjust background sounds and select types of rain. Worth the donation.,"January 29, 2018","Thanks very much for your support and kind words, Kara! So glad Rainy Mood helps you get your beauty sleep ðŸ˜™"
gp:AOqpTOG2pfQ7wHrQoPTWccBfjAiNJgANVNJeWABKxR_Ewyy6yQZpuYWWOKuNW5L8CXdv5Y0HeuIFc7MjB49U95Q,Faith Leopold,https://lh3.googleusercontent.com/-Zaws-QdOa9E/AAAAAAAAAAI/AAAAAAAAFlU/CnVePZKBLcc/w96-h96-p/photo.jpg,"December 17, 2017",https://play.google.com/store/apps/details?id=com.TailoredMusic.RainyMood&reviewId=Z3A6QU9xcFRPRzJwZlE3d0hyUW9QVFdjY0JmakFpTkpnQU5WTkplV0FCS3hSX0V3eXk2eVFacHVZV1dPS3VOVzVMOENYZHY1WTBIZXVJRmM3TWpCNDlVOTVR,5,,This is the most peaceful wonderful app. Please make a campfire rainymood!!,undefined,undefined
gp:AOqpTOG0prBSE5Ikx91nf-piZ03MQ0zkeo-cSp-Wx1fcX4D6lbhswNMaAHsjSubWgSyZ_WtVu9EJ7RSpJ8_CkS0,courtney rakestraw,https://lh4.googleusercontent.com/-F2fQBkTi5d0/AAAAAAAAAAI/AAAAAAAAFSw/NH_zCcQFsqs/w96-h96-p/photo.jpg,"January 1, 2018",https://play.google.com/store/apps/details?id=com.TailoredMusic.RainyMood&reviewId=Z3A6QU9xcFRPRzBwckJTRTVJa3g5MW5mLXBpWjAzTVEwemtlby1jU3AtV3gxZmNYNEQ2bGJoc3dOTWFBSHNqU3ViV2dTeVpfV3RWdTlFSjdSU3BKOF9Da1Mw,3,,Sleep timer doesn't work. Samsung S7,undefined,undefined
gp:AOqpTOFO_HbAupiprO6SY4Wp-FoiIuz63TFtJ8rVc26be5usaIMBT-3jQf_2Dti-K7cYoM19EGVh9_pGBjPQ5bs,Justin Duey,https://lh4.googleusercontent.com/-aCR98glbJj8/AAAAAAAAAAI/AAAAAAAAAAA/ACSILjUwslQ-V09LN_n-PvkbmvtOCewpyw/w96-h96-p/photo.jpg,"February 1, 2018",https://play.google.com/store/apps/details?id=com.TailoredMusic.RainyMood&reviewId=Z3A6QU9xcFRPRk9fSGJBdXBpcHJPNlNZNFdwLUZvaUl1ejYzVEZ0SjhyVmMyNmJlNXVzYUlNQlQtM2pRZl8yRHRpLUs3Y1lvTTE5RUdWaDlfcEdCalBRNWJz,4,,"Great app, used to use the website all the time, hope to see an option for  google home soon.",undefined,undefined
gp:AOqpTOFOrh9gAGVueCuMc1PCsgdTeV9ftBXoEBFgyIm6JkM3Cphp8sqwMxEXnfjdbUdg1h2JZCW59xjJW9d3aQk,hdturner,https://lh3.googleusercontent.com/-SaHaEXx90xU/AAAAAAAAAAI/AAAAAAAAAAA/ACSILjVjIDMjLpWhSm21S4zocPFEd11AWg/w96-h96-p/photo.jpg,"January 9, 2018",https://play.google.com/store/apps/details?id=com.TailoredMusic.RainyMood&reviewId=Z3A6QU9xcFRPRk9yaDlnQUdWdWVDdU1jMVBDc2dkVGVWOWZ0QlhvRUJGZ3lJbTZKa00zQ3BocDhzcXdNeEVYbmZqZGJVZGcxaDJKWkNXNTl4akpXOWQzYVFr,5,,I use the cafe setting together with some light coffeehouse jazz on Spotify all the time at work. It's amazing,undefined,undefined
gp:AOqpTOEUY-J3J8vVMuGKB0TPEtPlpOLwtyAPeprqaj-n7q7iKVV1ULH-DSTmKvrAuLQbIIo8HQonPaRmB7dZfYQ,April Hergert,https://lh4.googleusercontent.com/-DSmqzOcuy90/AAAAAAAAAAI/AAAAAAAAACs/beSh6dU_yQM/w96-h96-p/photo.jpg,"January 5, 2018",https://play.google.com/store/apps/details?id=com.TailoredMusic.RainyMood&reviewId=Z3A6QU9xcFRPRVVZLUozSjh2Vk11R0tCMFRQRXRQbHBPTHd0eUFQZXBycWFqLW43cTdpS1ZWMVVMSC1EU1RtS3ZyQXVMUWJJSW84SFFvblBhUm1CN2RaZllR,5,,"This helps me get to sleep every night, and helped me write 6000 words for work. Great app, many thanks.",undefined,undefined
gp:AOqpTOF4xO47vEu6p-7ODoM6EM-k6i9wLrGt_45pAaUKC6vnPmiERbSt-MaZC3aUVWxSisW6Z_LfF-5twtMqUd8,Rodrigo Giorgi,https://lh6.googleusercontent.com/-bzOS_CtT-o4/AAAAAAAAAAI/AAAAAAAATYk/DUFzOOZ4ObQ/w96-h96-p/photo.jpg,"December 10, 2017",https://play.google.com/store/apps/details?id=com.TailoredMusic.RainyMood&reviewId=Z3A6QU9xcFRPRjR4TzQ3dkV1NnAtN09Eb002RU0tazZpOXdMckd0XzQ1cEFhVUtDNnZuUG1pRVJiU3QtTWFaQzNhVVZXeFNpc1c2Wl9MZkYtNXR3dE1xVWQ4,5,,I asked for an off timer and they have done it! They are perfect!,undefined,undefined
gp:AOqpTOH0_GBV_JYG31ifedpDGJHadIhzdYWDG_mvEOnnvG-2gP2eM8U5nfHbDUvqo71s6rVz0VNdhuUy8Yo5ANc,,https://lh6.googleusercontent.com/-_XMNTuZ-qb8/AAAAAAAAAAI/AAAAAAAAAC8/HpghvbGGAQY/w96-h96-p/photo.jpg,"January 17, 2018",https://play.google.com/store/apps/details?id=com.TailoredMusic.RainyMood&reviewId=Z3A6QU9xcFRPSDBfR0JWX0pZRzMxaWZlZHBER0pIYWRJaHpkWVdER19tdkVPbm52Ry0yZ1AyZU04VTVuZkhiRFV2cW83MXM2clZ6MFZOZGh1VXk4WW81QU5j,2,,I can't figure out how to cast this to my Chromecast audio and have it play through my speakers.,undefined,undefined
gp:AOqpTOEQisEaaW_FeHkcxIct2UDzSWR9rrQpv-Rbfm30V3-pQbZzVhrXr4IVqSz2ay9ARwsx5Dhl4py2TOx4P58,,https://lh3.googleusercontent.com/-GztJlOcmcT0/AAAAAAAAAAI/AAAAAAAAAAA/XKJSE9lrNgE/w96-h96-p/photo.jpg,"December 21, 2017",https://play.google.com/store/apps/details?id=com.TailoredMusic.RainyMood&reviewId=Z3A6QU9xcFRPRVFpc0VhYVdfRmVIa2N4SWN0MlVEelNXUjlyclFwdi1SYmZtMzBWMy1wUWJaelZoclhyNElWcVN6MmF5OUFSd3N4NURobDRweTJUT3g0UDU4,4,,I'm enjoying it as I have tinnitus and it beats listening to the radio,undefined,undefined
gp:AOqpTOH4B6thbpHQ1_toT5mW_fVUFPTLlHGLtfzW6LLsCY8449Jcx9WqJk010fqO3HtsrWQFSs0h7hKz1jmE5aY,Angela Riley,https://lh3.googleusercontent.com/-BtKbB7-KsaU/AAAAAAAAAAI/AAAAAAAAAAA/ACSILjVKSzd_dwEXI6qYU0GWQLKIVH07HA/w96-h96-p/photo.jpg,"January 24, 2018",https://play.google.com/store/apps/details?id=com.TailoredMusic.RainyMood&reviewId=Z3A6QU9xcFRPSDRCNnRoYnBIUTFfdG9UNW1XX2ZWVUZQVExsSEdMdGZ6VzZMTHNDWTg0NDlKY3g5V3FKazAxMGZxTzNIdHNyV1FGU3MwaDdoS3oxam1FNWFZ,5,,Love the website and was excited to see they made an app. Definitely worth the money,undefined,undefined
gp:AOqpTOGeKvxFCfCy2zob7kkD-y9BjVwYnKLGxM7BuKwqORxzbnQt5JUXR04rZvShwDIp-VdXMC20c-Yh7MJDrig,Travis Cuperus,https://lh6.googleusercontent.com/-MHee6LOWzNs/AAAAAAAAAAI/AAAAAAAAAAA/ACSILjXnFFX5T3bGCpN4tbSPP4jO7C5H9A/w96-h96-p/photo.jpg,"December 8, 2017",https://play.google.com/store/apps/details?id=com.TailoredMusic.RainyMood&reviewId=Z3A6QU9xcFRPR2VLdnhGQ2ZDeTJ6b2I3a2tELXk5QmpWd1luS0xHeE03QnVLd3FPUnh6Ym5RdDVKVVhSMDRyWnZTaHdESXAtVmRYTUMyMGMtWWg3TUpEcmln,5,,Great for focusing or falling asleep,undefined,undefined
gp:AOqpTOEMQ7xu4sDIgXUiu8qwwgbwWE4FFBy_XPJQjVirdjw-2FCu3WZk201ZQ1akBWzSf4zLbD1jquuxw_GOJyg,,https://lh5.googleusercontent.com/-ihJ7J5mampU/AAAAAAAAAAI/AAAAAAAAJ3k/YLIZb0FUQyQ/w96-h96-p/photo.jpg,"December 30, 2017",https://play.google.com/store/apps/details?id=com.TailoredMusic.RainyMood&reviewId=Z3A6QU9xcFRPRU1RN3h1NHNESWdYVWl1OHF3d2did1dFNEZGQnlfWFBKUWpWaXJkanctMkZDdTNXWmsyMDFaUTFha0JXelNmNHpMYkQxanF1dXh3X0dPSnln,4,,"Nice app, only feature I really want is streaming to chromecast",undefined,undefined
gp:AOqpTOHB1Ooq76fyTKilQFoVVDNe3o1rVhDyCPm3QzCo5jIJIbPk-mnvt-neUp861_CVKDgutVzy3oli98Op-SE,Connor Henderson,https://lh6.googleusercontent.com/-nLctiCk_2ec/AAAAAAAAAAI/AAAAAAAAADg/p-KiBpkaRCI/w96-h96-p/photo.jpg,"February 4, 2018",https://play.google.com/store/apps/details?id=com.TailoredMusic.RainyMood&reviewId=Z3A6QU9xcFRPSEIxT29xNzZmeVRLaWxRRm9WVkROZTNvMXJWaER5Q1BtM1F6Q281aklKSWJQay1tbnZ0LW5lVXA4NjFfQ1ZLRGd1dFZ6eTNvbGk5OE9wLVNF,4,,"Fantastic app, just wish it had tin roof rain",undefined,undefined
gp:AOqpTOHICzDFlPZbBYgmJOB_GKDEtqHPtqC3ViYHhdCaHNxoZyMgAbATOmdXX3q1y6eFIVB5oOLXnTpO4DL95R8,,https://lh5.googleusercontent.com/-orC1IeRlj6o/AAAAAAAAAAI/AAAAAAAAALs/6Mfu6jUfVI4/w96-h96-p/photo.jpg,"December 12, 2017",https://play.google.com/store/apps/details?id=com.TailoredMusic.RainyMood&reviewId=Z3A6QU9xcFRPSElDekRGbFBaYkJZZ21KT0JfR0tERXRxSFB0cUMzVmlZSGhkQ2FITnhvWnlNZ0FiQVRPbWRYWDNxMXk2ZUZJVkI1b09MWG5UcE80REw5NVI4,5,,Helps me sleep,"December 14, 2017",Sleep is so important. Thank you kindly for your review. You rock! ðŸ¤“
