id,userName,userImage,date,url,score,title,text,replyDate,replyText
gp:AOqpTOHrNiuggjiWW1nubGOks1H7rcN2QtiN01yCob3d0_wkGWGC-D02dksSo9GDJGtUbNy1nHxk4MjMLbhdFw,Leo Ang Jr,https://lh4.googleusercontent.com/-tK3UL98lpKs/AAAAAAAAAAI/AAAAAAABF20/Vkiy51fsB7U/w96-h96-p/photo.jpg,"December 27, 2015",https://play.google.com/store/apps/details?id=com.luckyworld.stickerswhatsappemotion&reviewId=Z3A6QU9xcFRPSHJOaXVnZ2ppV1cxbnViR09rczFIN3JjTjJRdGlOMDF5Q29iM2QwX3drR1dHQy1EMDJka3NTbzlHREpHdFViTnkxbkh4azRNak1MYmhkRnc,4,"It's ""Tap,"" not ""Tab""","It's ""Tap,"" not ""Tab"" People are all confused over a misspelling in the instructions. It's ""Tap,"" not ""Tab."" You either Tap on an emoji then tap the green ""Whats app"" button at the bottom. Or you extend Tap an emoji and it opens up in WhatsApp. I agree about changing the black background to white. Otherwise it works just fine.",undefined,undefined
gp:AOqpTOE2FL-W6gWJrmqPfrJwyst8k2_AiqSquZvOsooVX0UAY4uTrgoHFgyN3_3AgLfuQYkdpPBIgbPRoj89Ow,Arpita Singh,https://lh5.googleusercontent.com/-F2bzWZyuXz4/AAAAAAAAAAI/AAAAAAAAAAA/ACSILjW14OUgOYVaSXPqRjfW5ojoNCmleQ/w96-h96-p/photo.jpg,"September 14, 2015",https://play.google.com/store/apps/details?id=com.luckyworld.stickerswhatsappemotion&reviewId=Z3A6QU9xcFRPRTJGTC1XNmdXSnJtcVBmckp3eXN0OGsyX0FpcVNxdVp2T3Nvb1ZYMFVBWTR1VHJnb0hGZ3lOM18zQWdMZnVRWWtkcFBCSWdiUFJvajg5T3c,4,They r cute...,They r cute... But wud actually like it more if black background removed. Also people..facing problem... there is button stating WhatsApp underneath the selected smiley clicking on that will take u to sharing ....all the best!,undefined,undefined
gp:AOqpTOFIah55JDrh9-lHSUWkLQKoK0uL9k-tbLZgCi_IPn_AljESTc_C_dp4WMAuHDjnjiS0K71uRWoPVCBirg,Daisy Washington,https://lh3.googleusercontent.com/-dHpmSot3ly4/AAAAAAAAAAI/AAAAAAAADT0/lsw7YQPftws/w96-h96-p/photo.jpg,"April 15, 2016",https://play.google.com/store/apps/details?id=com.luckyworld.stickerswhatsappemotion&reviewId=Z3A6QU9xcFRPRklhaDU1SkRyaDktbEhTVVdrTFFLb0swdUw5ay10YkxaZ0NpX0lQbl9BbGpFU1RjX0NfZHA0V01BdUhEam5qaVMwSzcxdVJXb1BWQ0Jpcmc,1,"Can't figure out how to ""share""","Can't figure out how to ""share"" App installed with no problems. Has great images but can't read all of directions at top of app explainable how to share. Tried simply tapping image but NOTHING happens when I do this. Anyone else experience problems?",undefined,undefined
gp:AOqpTOFMFAykZt4bqhWKmKY7-jwvscFDp1iPOnccK8zXTVes3448oGHcESVVPbC7aBsKk9TYJJHTr5AFgZUF-Q,Richard Raymundo,https://lh6.googleusercontent.com/-g3jvr2lusS4/AAAAAAAAAAI/AAAAAAAAAAA/ACSILjU7ZUcj3whMSdETpTiLxydt6Qa9BQ/w96-h96-p/photo.jpg,"June 22, 2016",https://play.google.com/store/apps/details?id=com.luckyworld.stickerswhatsappemotion&reviewId=Z3A6QU9xcFRPRk1GQXlrWnQ0YnFoV0ttS1k3LWp3dnNjRkRwMWlQT25jY0s4elhUVmVzMzQ0OG9HSGNFU1ZWUGJDN2FCc0trOVRZSkpIVHI1QUZnWlVGLVE,1,Not good,Not good It does not have a button to share the sticker. It's only a waste of time to download the app.  Pls fix the problem and then app users will install the app again. I do not recommend the app at this time.,undefined,undefined
gp:AOqpTOGOMTYDayh2Im2AYQYCLRXEbKEPiPMCHlujCWqTQJZVm09i9zv71hwm-x4UnSGtf3VnK22xxtdHCGNegQ,tam miller,https://lh3.googleusercontent.com/-UpTTb4eJWso/AAAAAAAAAAI/AAAAAAAAAAA/ACSILjVVTYfjZo0SCIKWDSIEU4gUFbeQrg/w96-h96-p/photo.jpg,"June 20, 2016",https://play.google.com/store/apps/details?id=com.luckyworld.stickerswhatsappemotion&reviewId=Z3A6QU9xcFRPR09NVFlEYXloMkltMkFZUVlDTFJYRWJLRVBpUE1DSGx1akNXcVRRSlpWbTA5aTl6djcxaHdtLXg0VW5TR3RmM1ZuSzIyeHh0ZEhDR05lZ1E,1,Useless,"Useless Always love emojis of this kind, i have the samsung 7 edge, there is no tab nor any type of share button which makes them worthless to try an use. Maybe your quality control or designers shoud do the job im sure theyre paid quite well for. Deleting this app since its impossible to use.",undefined,undefined
gp:AOqpTOEPk3qAEdBx3np8tjx2iGT7ckSbvb6B1TOgGUxeeT5xQ40gU-rZdG5vwHVgDbT9dctFYksQOfijA07rPw,Ms Lady,https://lh6.googleusercontent.com/-c7UVdiatBEo/AAAAAAAAAAI/AAAAAAAAAUg/ZTNTeUrQi44/w96-h96-p/photo.jpg,"September 4, 2015",https://play.google.com/store/apps/details?id=com.luckyworld.stickerswhatsappemotion&reviewId=Z3A6QU9xcFRPRVBrM3FBRWRCeDNucDh0angyaUdUN2NrU2J2YjZCMVRPZ0dVeGVlVDV4UTQwZ1UtclpkRzV2d0hWZ0RiVDlkY3RGWWtzUU9maWpBMDdyUHc,1,Hate it,"Hate it The emoticons attached to whatsapp are very big. Not suitable to chat. Same like we attach a photo to our frens. Emoticon should be small size, not a big photo size.",undefined,undefined
gp:AOqpTOHEElM7fHFXRi_RXFs3_VTVswvgeM6pN8qubN2bAVGtxtTEcyQhL8yDHvHPU1pYZJtC1blqDABvaHHipg,Amy Hurst,https://lh6.googleusercontent.com/-ENF83cdHEpA/AAAAAAAAAAI/AAAAAAAAADk/6Fe8YxGaOdU/w96-h96-p/photo.jpg,"December 16, 2016",https://play.google.com/store/apps/details?id=com.luckyworld.stickerswhatsappemotion&reviewId=Z3A6QU9xcFRPSEVFbE03ZkhGWFJpX1JYRnMzX1ZUVnN3dmdlTTZwTjhxdWJOMmJBVkd0eHRURWN5UWhMOHlESHZIUFUxcFlaSnRDMWJscURBQnZhSEhpcGc,1,Can't share images,"Can't share images The 'what's app' button does nothing. Really like the images, but if unable to share, I'll just delete the app. Disappointing!",undefined,undefined
gp:AOqpTOE9p7H-V6yLbqzsO8ACMLexsDB_U57VYYD2iQuoW3z6yRm-xEEN4Gq21PYiLTdiK-i32y58JqIBlXSpAg,Teresa Stafford,https://lh6.googleusercontent.com/-QeCcKOg794I/AAAAAAAAAAI/AAAAAAAAF7c/VFUdueQtO1I/w96-h96-p/photo.jpg,"June 1, 2015",https://play.google.com/store/apps/details?id=com.luckyworld.stickerswhatsappemotion&reviewId=Z3A6QU9xcFRPRTlwN0gtVjZ5TGJxenNPOEFDTUxleHNEQl9VNTdWWVlEMmlRdW9XM3o2eVJtLXhFRU40R3EyMVBZaUxUZGlLLWkzMnk1OEpxSUJsWFNwQWc,4,,"Would not work on my Samsung 4. Very frustrating. I learned from another app. When you tap the emoticon, it saves to your picture gallery, you share it from there.  Better description, instruction on this app would be helpful.",undefined,undefined
gp:AOqpTOGGDLA31OIN0BIYvQZPGG1JAjVfdqx6qc8UVwtQX37oxvhTqwO5UZNBpiiZ3sZZQnM32eFHzwUwNqnLNQ,Diana Martin,https://lh5.googleusercontent.com/-HL_9gHdmlTU/AAAAAAAAAAI/AAAAAAAACDI/Mw7e7jghoGE/w96-h96-p/photo.jpg,"August 10, 2016",https://play.google.com/store/apps/details?id=com.luckyworld.stickerswhatsappemotion&reviewId=Z3A6QU9xcFRPR0dETEEzMU9JTjBCSVl2UVpQR0cxSkFqVmZkcXg2cWM4VVZ3dFFYMzdveHZoVHF3TzVVWk5CcGlpWjNzWlpRbk0zMmVGSHp3VXdOcW5MTlE,1,Wth?,"Wth? Love the emojis but can't share them. It's not a mispelling error, the stupid button doesn't work! I'm uninstalling it now.",undefined,undefined
gp:AOqpTOFc9dMalXA0WWlde8EfRmc0baHVV_ntFovMor9TZxpy1ekAl-nKrdxFEcyjPFgRjYjlm9SlbiDJwCe1UQ,Miss W,https://lh4.googleusercontent.com/-hlo6XR7nHVg/AAAAAAAAAAI/AAAAAAAAAAA/ACSILjVW6vqdwGQCQuIFprsKqO_fGQs4Zw/w96-h96-p/photo.jpg,"December 14, 2015",https://play.google.com/store/apps/details?id=com.luckyworld.stickerswhatsappemotion&reviewId=Z3A6QU9xcFRPRmM5ZE1hbFhBMFdXbGRlOEVmUm1jMGJhSFZWX250Rm92TW9yOVRaeHB5MWVrQWwtbktyZHhGRWN5alBGZ1JqWWpsbTlTbGJpREp3Q2UxVVE,1,No Tab to share,No Tab to share Very cute but there's no share button at all. If there is no share button this app is pretty much worthless.,undefined,undefined
gp:AOqpTOFg4yd0toUOqGGNMXY3Gag5yv_FYaK14XkoSNdjaj1XWAii5PTgUBf65FnjN-POMtxB47rbqQxKc-tD5A,Debi Bertran,https://lh4.googleusercontent.com/-82aAGBaZoOs/AAAAAAAAAAI/AAAAAAAAAAA/ACSILjV9aYx7AfXQrUxnAf1TT4_4au7QBA/w96-h96-p/photo.jpg,"January 26, 2016",https://play.google.com/store/apps/details?id=com.luckyworld.stickerswhatsappemotion&reviewId=Z3A6QU9xcFRPRmc0eWQwdG9VT3FHR05NWFkzR2FnNXl2X0ZZYUsxNFhrb1NOZGphajFYV0FpaTVQVGdVQmY2NUZuak4tUE9NdHhCNDdyYnFReEtjLXRENUE,2,Loved the stickers,Loved the stickers There was no tab button when I held down on a sticker.  I was bummed that it didn't work for my Samsung Galaxy S4 tablet.,undefined,undefined
gp:AOqpTOGpnUG7KVLOivQcuO34zyFzxSK0BU_1bizp-MDWr7BJsDlD2-FUFoQhA2W60TEuGuvOlIfHZa4IymXlgg,Robert Butler,https://lh3.googleusercontent.com/-tmDR3COnRhc/AAAAAAAAAAI/AAAAAAAAAAA/ACSILjVgIKUDe4pc0OhhfIhYfJEDQwAn-Q/w96-h96-p/photo.jpg,"December 11, 2015",https://play.google.com/store/apps/details?id=com.luckyworld.stickerswhatsappemotion&reviewId=Z3A6QU9xcFRPR3BuVUc3S1ZMT2l2UWN1TzM0enlGenhTSzBCVV8xYml6cC1NRFdyN0JKc0RsRDItRlVGb1FoQTJXNjBURXVHdXZPbElmSFphNEl5bVhsZ2c,1,,This app doesnt work. There is no share button. To share them. Disappointed.,undefined,undefined
gp:AOqpTOFge41NDsJ-xhOysGccTak0dw-BtQ9TiB0_RCFBqN9ITunMgU55w_TNuZAhUJvwTGPdjLTQ9cQlrxZVMw,Carlton691,https://lh4.googleusercontent.com/-Eu0vWEChlnE/AAAAAAAAAAI/AAAAAAAAAAA/ACSILjUY1uPEgcbR6Y6T3Gfq8XfupztSZQ/w96-h96-p/photo.jpg,"August 12, 2015",https://play.google.com/store/apps/details?id=com.luckyworld.stickerswhatsappemotion&reviewId=Z3A6QU9xcFRPRmdlNDFORHNKLXhoT3lzR2NjVGFrMGR3LUJ0UTlUaUIwX1JDRkJxTjlJVHVuTWdVNTV3X1ROdVpBaFVKdndUR1BkakxUUTljUWxyeFpWTXc,2,,Until the images called Emoji's are set in the text input box as with the standard Emoji's then the images in this app can not be considered Emoji's... Rather than pictures with a message tacked On... :^(,undefined,undefined
gp:AOqpTOE0UjFf1NvdvCIJ_lzQhLJ5DT8LpNtr2gDpRTaZPBoXfQBb60i3IScdu-fQmcZeiwqwU928yY3YPNKLGQ,Brandie Fournerat,https://lh5.googleusercontent.com/-go14f57qDzU/AAAAAAAAAAI/AAAAAAAAAAA/ACSILjW0Lxd2f45eKPaeq71dNHopfUOJoA/w96-h96-p/photo.jpg,"February 9, 2016",https://play.google.com/store/apps/details?id=com.luckyworld.stickerswhatsappemotion&reviewId=Z3A6QU9xcFRPRTBVakZmMU52ZHZDSUpfbHpRaExKNURUOExwTnRyMmdEcFJUYVpQQm9YZlFCYjYwaTNJU2NkdS1mUW1jWmVpd3F3VTkyOHlZM1lQTktMR1E,1,Doesn't work,Doesn't work Love the stickers nut no tab button when I hold it down it doesn't work so please please fix or I will have to delete :(,undefined,undefined
gp:AOqpTOEkkMGMenhS212_5Sml-cQFPOnjxateume9NEYlhUckuf4KwR9QDUyGOWpdXrmAw_PY4CJqx5kjeG58YQ,winnie moore,https://lh4.googleusercontent.com/-qQueAAF6yKQ/AAAAAAAAAAI/AAAAAAAAAAA/ACSILjVnAwfFFO73GZH-rNmSkw5UJRXsEw/w96-h96-p/photo.jpg,"May 28, 2015",https://play.google.com/store/apps/details?id=com.luckyworld.stickerswhatsappemotion&reviewId=Z3A6QU9xcFRPRWtrTUdNZW5oUzIxMl81U21sLWNRRlBPbmp4YXRldW1lOU5FWWxoVWNrdWY0S3dSOVFEVXlHT1dwZFhybUF3X1BZNENKcXg1a2plRzU4WVE,2,Samsung Galaxy 5,Samsung Galaxy 5 Can't seem to share but they are cute,undefined,undefined
gp:AOqpTOFBw7Vr61Mqiz-AOxBmpJdwNy2LUiqwsf8V6qIhGhGp8xhMt5tbaC-bQkxh8n6paSVVzFgzQ2TuPEbpEA,Tom Bombie,https://lh6.googleusercontent.com/-GP3lvB6iCNA/AAAAAAAAAAI/AAAAAAAABpY/HOaL9_unAgc/w96-h96-p/photo.jpg,"November 9, 2016",https://play.google.com/store/apps/details?id=com.luckyworld.stickerswhatsappemotion&reviewId=Z3A6QU9xcFRPRkJ3N1ZyNjFNcWl6LUFPeEJtcEpkd055MkxVaXF3c2Y4VjZxSWhHaEdwOHhoTXQ1dGJhQy1iUWt4aDhuNnBhU1ZWekZnelEyVHVQRWJwRUE,1,Risky,"Risky THIS APP IS USED FOR DATA MINING. IT SENDS LOCATION, APPS LIST AND MORE TO PLACES SUCH AS AMERICA.",undefined,undefined
gp:AOqpTOEeauuqRA7XleCDH8_h8UHLTuc5yCV5B7fy7H2skVeFvStfR8dSYQ8VDDGvbv8Qe7ke-3zzTNTw8xzLHw,Aretha Gaitor,https://lh4.googleusercontent.com/-dPjJE_ufIMQ/AAAAAAAAAAI/AAAAAAAAJYU/6dKztgDwzdE/w96-h96-p/photo.jpg,"August 13, 2015",https://play.google.com/store/apps/details?id=com.luckyworld.stickerswhatsappemotion&reviewId=Z3A6QU9xcFRPRWVhdXVxUkE3WGxlQ0RIOF9oOFVITFR1YzV5Q1Y1QjdmeTdIMnNrVmVGdlN0ZlI4ZFNZUThWRERHdmJ2OFFlN2tlLTN6elROVHc4eHpMSHc,4,Great App,"Great App Works great for me on my Note 3..was tired of the same old smileys, thank you!",undefined,undefined
gp:AOqpTOE1OBbximzsjEu02ExHIgfY0RKeEVWFkS0cIti88sC4lIo3veEMk2b7KsAj2d9yy6mQKvHWR-F6Z1ABbg,Dee Webb,https://lh3.googleusercontent.com/-dXNP5P4gM6k/AAAAAAAAAAI/AAAAAAAAAAA/ACSILjUPmf_CPEeOfku3j2FiCXWwZoWBdw/w96-h96-p/photo.jpg,"August 27, 2015",https://play.google.com/store/apps/details?id=com.luckyworld.stickerswhatsappemotion&reviewId=Z3A6QU9xcFRPRTFPQmJ4aW16c2pFdTAyRXhISWdmWTBSS2VFVldGa1MwY0l0aTg4c0M0bElvM3ZlRU1rMmI3S3NBajJkOXl5Nm1RS3ZIV1ItRjZaMUFCYmc,1,Dee,Dee Can't get it to work. It keep telling me to hit share button  but there is no share button  showing up. I will be uninstalling again.,undefined,undefined
gp:AOqpTOFm5aGmqU9sc32OjbWO7iySjjfLtOmAgNxlG-gHgp0AXrJUF7LGlOKgtt4f7JoPk6h91V6BjFhhF-009Q,STEPHEN SHAW,https://lh5.googleusercontent.com/-6vFJIfiiMtE/AAAAAAAAAAI/AAAAAAAAAAA/ACSILjULzgNwHQ0IcpvpSXEgGTAMLCdnBA/w96-h96-p/photo.jpg,"August 7, 2015",https://play.google.com/store/apps/details?id=com.luckyworld.stickerswhatsappemotion&reviewId=Z3A6QU9xcFRPRm01YUdtcVU5c2MzMk9qYldPN2l5U2pqZkx0T21BZ054bEctZ0hncDBBWHJKVUY3TEdsT0tndHQ0ZjdKb1BrNmg5MVY2QmpGaGhGLTAwOVE,4,,"Problem. Cannot get the stickers. In to mail or get anything to send in mail, very complicated not working. I like the smileys, a lot. Tab share button, does not work. Cannot find tab share button.",undefined,undefined
gp:AOqpTOGpxJdfQzyID1R9hwQdAT1NdZDu7jDDZD3nD169Z1E-sNk6cYPeqwSyP2szdKyPgKo35zASkQ_WqiNbfw,Madison Michelle,https://lh4.googleusercontent.com/-KXdAwGmjJgo/AAAAAAAAAAI/AAAAAAAATjE/d3UTeDd_nqk/w96-h96-p/photo.jpg,"October 31, 2015",https://play.google.com/store/apps/details?id=com.luckyworld.stickerswhatsappemotion&reviewId=Z3A6QU9xcFRPR3B4SmRmUXp5SUQxUjlod1FkQVQxTmRaRHU3akREWkQzbkQxNjlaMUUtc05rNmNZUGVxd1N5UDJzemRLeVBnS28zNXpBU2tRX1dxaU5iZnc,1,Can't Find The Share Button Either.,"Can't Find The Share Button Either. Like the stickers, but no clear instructions on how to properly work it. I'm uninstalling it.",undefined,undefined
gp:AOqpTOH0N0jskb4ZtD82bvP85uVy5x74LnbWGQWTRpfa0Nx11iYBqu85bVhgNV9Goigd96mmgo8kcZgSTBYliw,Dale Edwards jr,https://lh5.googleusercontent.com/-Yp-HRj-JfLI/AAAAAAAAAAI/AAAAAAAAAGo/2AKWNe4yZRg/w96-h96-p/photo.jpg,"December 21, 2015",https://play.google.com/store/apps/details?id=com.luckyworld.stickerswhatsappemotion&reviewId=Z3A6QU9xcFRPSDBOMGpza2I0WnREODJidlA4NXVWeTV4NzRMbmJXR1FXVFJwZmEwTngxMWlZQnF1ODViVmhnTlY5R29pZ2Q5Nm1tZ284a2NaZ1NUQllsaXc,1,Don't work never has,"Don't work never has Installed a while ago tried to use no button to share , wait a while to use and still nothing  Total junk !  READ YOUR REVIEWS  !!!!",undefined,undefined
gp:AOqpTOGxMyh3O7zRtjoJ8h_tw3Hb_83xsTxzlWFzmsvus2DEKlJWcNSyIcLyzPmBOh5D7Rt4oZjflf2MDy8uxQ,Clinton Té la,https://lh3.googleusercontent.com/-ovcXO7s1a04/AAAAAAAAAAI/AAAAAAAAKHQ/0wpdZDXS9No/w96-h96-p/photo.jpg,"September 18, 2016",https://play.google.com/store/apps/details?id=com.luckyworld.stickerswhatsappemotion&reviewId=Z3A6QU9xcFRPR3hNeWgzTzd6UnRqb0o4aF90dzNIYl84M3hzVHh6bFdGem1zdnVzMkRFS2xKV2NOU3lJY0x5elBtQk9oNUQ3UnQ0b1pqZmxmMk1EeTh1eFE,2,Take background off. Yuck,"Take background off. Yuck Just leave the head, no frame also  then youll get 5 stars.",undefined,undefined
gp:AOqpTOEDLTlq8r87Xzo_tCbSKI4ArsTsZMRUvs3E8NSKEK7Kbg1cd3LRVH5b8T-kI0l7iOms0ODqr6z4iBdeVA,Riju A,https://lh3.googleusercontent.com/-IMMNONs2k_U/AAAAAAAAAAI/AAAAAAAAABs/uNc9jYpezkM/w96-h96-p/photo.jpg,"September 14, 2015",https://play.google.com/store/apps/details?id=com.luckyworld.stickerswhatsappemotion&reviewId=Z3A6QU9xcFRPRURMVGxxOHI4N1h6b190Q2JTS0k0QXJzVHNaTVJVdnMzRThOU0tFSzdLYmcxY2QzTFJWSDViOFQta0kwbDdpT21zME9EcXI2ejRpQmRlVkE,2,Black background,"Black background The background changes to black once the emoji is pasted so the beauty of the image is lost. These images, look best on white background. App makers should consider changing it.",undefined,undefined
gp:AOqpTOHZ3mI81FN3sccmNHlu8n2GjQTPr5_ZY2eTgLiWWF0ypufjRvEfaKMJvjUFRYlRRk84EP1Vlot8K2r6sQ,milos milos,https://lh3.googleusercontent.com/-wbwQf72tHK0/AAAAAAAAAAI/AAAAAAAAAAA/ACSILjUxJ3232yTZGNo-uGxRFq5-0F12cA/w96-h96-p/photo.jpg,"April 23, 2016",https://play.google.com/store/apps/details?id=com.luckyworld.stickerswhatsappemotion&reviewId=Z3A6QU9xcFRPSFozbUk4MUZOM3NjY21OSGx1OG4yR2pRVFByNV9aWTJlVGdMaVdXRjB5cHVmalJ2RWZhS01KdmpVRlJZbFJSazg0RVAxVmxvdDhLMnI2c1E,3,,Don't like the black background. Would be much better without it,undefined,undefined
gp:AOqpTOGvFbpobluBbRb1AlV0gtz4lK4MDapaFzngokktG29enlyYaD3scM5ICuqZGZU0e5nbeu_QZ9ttNPUVJg,Cheryl Stevens,https://lh4.googleusercontent.com/-bHsJfeAW8Zk/AAAAAAAAAAI/AAAAAAAAAAA/ACSILjUlE7xmHbAHTGgfgJHLSS_NoN4xKA/w96-h96-p/photo.jpg,"May 24, 2016",https://play.google.com/store/apps/details?id=com.luckyworld.stickerswhatsappemotion&reviewId=Z3A6QU9xcFRPR3ZGYnBvYmx1QmJSYjFBbFYwZ3R6NGxLNE1EYXBhRnpuZ29ra3RHMjllbmx5WWFEM3NjTTVJQ3VxWkdaVTBlNW5iZXVfUVo5dHROUFVWSmc,2,,It won't let me send anything. It says to tap the share button but there isn't one. I'm uninstalling,undefined,undefined
gp:AOqpTOEL5bdW6VxP3CQnvzMxcoYRgtIeSJOOuI9jpfjHKiDi8FQBl3jskYZSI7hXFE4Fs6Fzz2qIKaDM1lhIZg,Bret Barker,https://lh5.googleusercontent.com/-QCPs6cQltGI/AAAAAAAAAAI/AAAAAAAABls/4ytUynSjGYE/w96-h96-p/photo.jpg,"February 3, 2017",https://play.google.com/store/apps/details?id=com.luckyworld.stickerswhatsappemotion&reviewId=Z3A6QU9xcFRPRUw1YmRXNlZ4UDNDUW52ek14Y29ZUmd0SWVTSk9PdUk5anBmakhLaURpOEZRQmwzanNrWVpTSTdoWEZFNEZzNkZ6ejJxSUthRE0xbGhJWmc,1,,Adds block the share tab. Pretty cool emoji collection but can't use it,undefined,undefined
gp:AOqpTOH6mMoypA7Z9yzKdPhiUKpvmUlTJkgZjuHMIwfz6C1jsqKtxC27KGUq8NL7CNQOmxlfoQlyfNmvbTALkQ,Divya Vishwakarma,https://lh6.googleusercontent.com/-MspAVnV1Jgs/AAAAAAAAAAI/AAAAAAAABVM/cUj7rpTpU9o/w96-h96-p/photo.jpg,"July 22, 2016",https://play.google.com/store/apps/details?id=com.luckyworld.stickerswhatsappemotion&reviewId=Z3A6QU9xcFRPSDZtTW95cEE3Wjl5ektkUGhpVUtwdm1VbFRKa2daanVITUl3Zno2QzFqc3FLdHhDMjdLR1VxOE5MN0NOUU9teGxmb1FseWZObXZiVEFMa1E,1,,Bakwaas....Sorryyyyy...My mistake..Maha Bakwaas app....I mean how childish app. It is........Bhagwan k liye galti se install mat karna....aagey aapki marzi....Janhit mei jaari.....,undefined,undefined
gp:AOqpTOHVZNnvy6E9DhRKdYxyHvr67XXQDC_uXk49UPirlYkVQsQuRJp36RWG9c1pPcFu8yHxFvhh-BzTtpmsbQ,Danielle 720,https://lh6.googleusercontent.com/-KTMN1fycmMI/AAAAAAAAAAI/AAAAAAAAACw/zcrehK--XvY/w96-h96-p/photo.jpg,"February 27, 2016",https://play.google.com/store/apps/details?id=com.luckyworld.stickerswhatsappemotion&reviewId=Z3A6QU9xcFRPSFZaTm52eTZFOURoUktkWXh5SHZyNjdYWFFEQ191WGs0OVVQaXJsWWtWUXNRdVJKcDM2UldHOWMxcFBjRnU4eUh4RnZoaC1CelR0cG1zYlE,2,It didn't work,It didn't work It said tab share button to share but there was no share button I don't reccomend it,undefined,undefined
gp:AOqpTOF8KAmOhnDnPfEYbqNj8KyKc0Z8A_eCdmhoAnakoI-mw5AQdIs05uKMZZUgBfM_ghGPWRtC7QjF2lRsZg,Jerry McFadyen,https://lh4.googleusercontent.com/-D1Gn_5xf_lA/AAAAAAAAAAI/AAAAAAAAAZ8/SKyQOD-EVbg/w96-h96-p/photo.jpg,"April 11, 2016",https://play.google.com/store/apps/details?id=com.luckyworld.stickerswhatsappemotion&reviewId=Z3A6QU9xcFRPRjhLQW1PaG5EblBmRVlicU5qOEt5S2MwWjhBX2VDZG1ob0FuYWtvSS1tdzVBUWRJczA1dUtNWlpVZ0JmTV9naEdQV1J0QzdRakYybFJzWmc,1,No share tab,No share tab Holding down on it does not work either. Waste of time,undefined,undefined
gp:AOqpTOFO-fYLEMe2QLdJNpXpkUmFeA4AreYbsLnlDlPR918UptjpwvK_Pg1ZkodM-09jLytL6Mg2hR3HXnxo5w,,https://lh4.googleusercontent.com/-J9i83vtqz7w/AAAAAAAAAAI/AAAAAAAAAAA/DAIH_vD_2ds/w96-h96-p/photo.jpg,"November 5, 2016",https://play.google.com/store/apps/details?id=com.luckyworld.stickerswhatsappemotion&reviewId=Z3A6QU9xcFRPRk8tZllMRU1lMlFMZEpOcFhwa1VtRmVBNEFyZVlic0xubERsUFI5MThVcHRqcHd2S19QZzFaa29kTS0wOWpMeXRMNk1nMmhSM0hYbnhvNXc,4,Intuitive things,Intuitive things Sometimes a picture can say a thousand words. How about some birthday ones!!,undefined,undefined
gp:AOqpTOELXIIqf6_NI_gf8T9nIiH6YxCrUIAVXoaBIdtnkz3HvQWegDiEhsy7qQsRaQKE0guCiLYUKU3nQa3kvg,Steve Meyer,https://lh3.googleusercontent.com/-zQWU80HGzzA/AAAAAAAAAAI/AAAAAAAAAAA/ACSILjXXl2Ft-N7fIbTtm3u27kSwI_6Bzg/w96-h96-p/photo.jpg,"August 30, 2015",https://play.google.com/store/apps/details?id=com.luckyworld.stickerswhatsappemotion&reviewId=Z3A6QU9xcFRPRUxYSUlxZjZfTklfZ2Y4VDluSWlINll4Q3JVSUFWWG9hQklkdG5rejNIdlFXZWdEaUVoc3k3cVFzUmFRS0UwZ3VDaUxZVUtVM25RYTNrdmc,1,,How in the hell do u get to work?unstalled it til the developer fixes the problem.,undefined,undefined
gp:AOqpTOHcM-vKIKXzVXjCR2uNeFm32Ncp-8_gKB3cKiVDRe-YUw03J3uAkoRtFJdwgbHW-yjbbizAEIfxosHKSg,sarathy k,https://lh6.googleusercontent.com/-Sy1NSCpX1uQ/AAAAAAAAAAI/AAAAAAAAAC4/w1Jlq-5V29Q/w96-h96-p/photo.jpg,"September 21, 2015",https://play.google.com/store/apps/details?id=com.luckyworld.stickerswhatsappemotion&reviewId=Z3A6QU9xcFRPSGNNLXZLSUtYelZYakNSMnVOZUZtMzJOY3AtOF9nS0IzY0tpVkRSZS1ZVXcwM0ozdUFrb1J0Rkpkd2diSFcteWpiYml6QUVJZnhvc0hLU2c,1,Worst App,Worst App This App not user friendly.its really tough using. Stickers were not worth.,undefined,undefined
gp:AOqpTOGB6Joy_lm9WEfPllbBc4ucb1a3xXWwhOmFcrphu3dVLfkHUI-4PVDe0RgQt3Mm8EJh0CB-hmcPmS4LmA,kelvin msakanda,https://lh4.googleusercontent.com/-ga-mgE9VlTQ/AAAAAAAAAAI/AAAAAAAAH2Y/dbyc5dtg2ns/w96-h96-p/photo.jpg,"September 10, 2015",https://play.google.com/store/apps/details?id=com.luckyworld.stickerswhatsappemotion&reviewId=Z3A6QU9xcFRPR0I2Sm95X2xtOVdFZlBsbGJCYzR1Y2IxYTN4WFd3aE9tRmNycGh1M2RWTGZrSFVJLTRQVkRlMFJnUXQzTW04RUpoMENCLWhtY1BtUzRMbUE,1,Useless,Useless Can't find the share button,undefined,undefined
gp:AOqpTOE7ANX60TIDFJRRKBiSagdMUv041E-KY2Y9OUIzKHF_pFzvzEWfsJqz-2r_H2XkQV3-7M5BlkGTpOZ7Pw,Avanthika Nagarajan,https://lh6.googleusercontent.com/-7UY0kx4vmhM/AAAAAAAAAAI/AAAAAAAAAAA/ACSILjVH68UcVi6QqQkJc6v9iiLcq3U8TQ/w96-h96-p/photo.jpg,"March 20, 2016",https://play.google.com/store/apps/details?id=com.luckyworld.stickerswhatsappemotion&reviewId=Z3A6QU9xcFRPRTdBTlg2MFRJREZKUlJLQmlTYWdkTVV2MDQxRS1LWTJZOU9VSXpLSEZfcEZ6dnpFV2ZzSnF6LTJyX0gyWGtRVjMtN001QmxrR1RwT1o3UHc,2,Can't find share button,Can't find share button There's no share button to share these emojis. Plz fix asap!,undefined,undefined
gp:AOqpTOGb7_ipQnFcFIwg8gfYIm88EAvmX8cEA2x8IVNIsPHoQLKQ5cAccboFHEJExEB6kr-z1O8djdJWn5no-g,Oduro Bismark,https://lh4.googleusercontent.com/-UAtVKl4mzsU/AAAAAAAAAAI/AAAAAAAAAAA/ACSILjWQpE98Fl_Wxd5AIY99OpZuVaOtIQ/w96-h96-p/photo.jpg,"November 21, 2015",https://play.google.com/store/apps/details?id=com.luckyworld.stickerswhatsappemotion&reviewId=Z3A6QU9xcFRPR2I3X2lwUW5GY0ZJd2c4Z2ZZSW04OEVBdm1YOGNFQTJ4OElWTklzUEhvUUxLUTVjQWNjYm9GSEVKRXhFQjZrci16MU84ZGpkSlduNW5vLWc,3,Fix it,Fix it '' 'error during saving picture''' I have been using this app for a very long time but it's misbehaving this time. Please fix it asap !!!!!!!!!!!,undefined,undefined
gp:AOqpTOHzlEPf_5wqxsntbVFGNtThkaqsuXDWomMgyK_wB3rzRXHoKvENnDKQl11CMcqI08S6Ydf2GyPAHZQwzQ,Lb Brinley,https://lh6.googleusercontent.com/-GcYe-iBKMNk/AAAAAAAAAAI/AAAAAAAAAEY/Fm6zHbik_Ew/w96-h96-p/photo.jpg,"May 1, 2015",https://play.google.com/store/apps/details?id=com.luckyworld.stickerswhatsappemotion&reviewId=Z3A6QU9xcFRPSHpsRVBmXzV3cXhzbnRiVkZHTnRUaGthcXN1WERXb21NZ3lLX3dCM3J6UlhIb0t2RU5uREtRbDExQ01jcUkwOFM2WWRmMkd5UEFIWlF3elE,1,Dont work,Dont work Emotions just show as Chinese symbols. Avoid,undefined,undefined
gp:AOqpTOElcqollVQfQ25f4j7VhZMAxCbzklme4pAQRRzyLZ0uGvrOh_sb7RbI8vR1054ml8TR-0IaoG23esq7jQ,John Murray,https://lh6.googleusercontent.com/-5kpBthuecZc/AAAAAAAAAAI/AAAAAAAAAUA/ZsAY7PLgi8c/w96-h96-p/photo.jpg,"June 6, 2017",https://play.google.com/store/apps/details?id=com.luckyworld.stickerswhatsappemotion&reviewId=Z3A6QU9xcFRPRWxjcW9sbFZRZlEyNWY0ajdWaFpNQXhDYnprbG1lNHBBUVJSenlMWjB1R3ZyT2hfc2I3UmJJOHZSMTA1NG1sOFRSLTBJYW9HMjNlc3E3alE,3,,"Great Stickers,but there's no SHARE setting's to tap to share. What it is,you Press the sticker,then it saves into your Gallery. Its not for sharing .",undefined,undefined
gp:AOqpTOFIIACL93J15F2aU3hU8gxnnjq_IpfgJv3TNWYAXDVdafRoFmFz-vKUxdTTOyH1NchHXWQ2-s00aj-M0A,Madhu Nano,https://lh4.googleusercontent.com/-ceqBNwDWcrI/AAAAAAAAAAI/AAAAAAAAACE/YQ_NW6ppUAc/w96-h96-p/photo.jpg,"September 14, 2015",https://play.google.com/store/apps/details?id=com.luckyworld.stickerswhatsappemotion&reviewId=Z3A6QU9xcFRPRklJQUNMOTNKMTVGMmFVM2hVOGd4bm5qcV9JcGZnSnYzVE5XWUFYRFZkYWZSb0ZtRnotdktVeGRUVE95SDFOY2hIWFdRMi1zMDBhai1NMEE,1,,Stickers are coming like photos...not at all liked..waste to install,undefined,undefined
gp:AOqpTOHhd_REIrSnQF8O_25V2c5WI_1ZNmIzZCIl9sQNwgE7Cgw-9doe1rrvCZWOtd5cG7Z8yJS8Qm1aSUkvMg,sugar walls,https://lh5.googleusercontent.com/-Z9tAKaL1mvY/AAAAAAAAAAI/AAAAAAAAAAA/ACSILjUJW8IvoSqcAApmLTQJZFPvZfAZ3g/w96-h96-p/photo.jpg,"April 7, 2016",https://play.google.com/store/apps/details?id=com.luckyworld.stickerswhatsappemotion&reviewId=Z3A6QU9xcFRPSGhkX1JFSXJTblFGOE9fMjVWMmM1V0lfMVpObUl6WkNJbDlzUU53Z0U3Q2d3LTlkb2UxcnJ2Q1pXT3RkNWNHN1o4eUpTOFFtMWFTVWt2TWc,5,Momo,Momo Amazing been using it for years and it gets better every day,undefined,undefined
gp:AOqpTOGTwEnUvTN_JRPdFQI8XG2jX5JFKAZupxGnMiKitNKBY2g7Qhnln83j0OavF99hFalTcid4jsL08t2Oeg,Nora Adame,https://lh5.googleusercontent.com/-gb3pvGE24Ho/AAAAAAAAAAI/AAAAAAAAAAA/ACSILjWe5HWcF6FVdsj1B6uyrd1GlQAkDg/w96-h96-p/photo.jpg,"April 7, 2016",https://play.google.com/store/apps/details?id=com.luckyworld.stickerswhatsappemotion&reviewId=Z3A6QU9xcFRPR1R3RW5VdlROX0pSUGRGUUk4WEcyalg1SkZLQVp1cHhHbk1pS2l0TktCWTJnN1FobmxuODNqME9hdkY5OWhGYWxUY2lkNGpzTDA4dDJPZWc,1,,Yo pensé que se ponían automáticamente en el WhatsApp no me gusto,undefined,undefined
